aiter/configs/a4w4_blockscale_tuned_gemm.csv
cu_num,M,N,K,kernelId,splitK,us,kernelName
256,1,16384,16384,0,0,49.0507,a4w4_blockscale_256x64x128x128_16x16_16x16_8x32x1_8x32x1_1x32x1x8_8_2x2_intrawave_v3
256,1,106496,16384,1,0,170.4309,a4w4_blockscale_256x64x256x128_16x16_16x16_8x32x1_8x32x1_1x32x1x8_8_2x2_intrawave_v3
256,1,16384,53248,0,0,156.56,a4w4_blockscale_256x64x128x128_16x16_16x16_8x32x1_8x32x1_1x32x1x8_8_2x2_intrawave_v3
256,1,18432,16384,0,0,48.5148,a4w4_blockscale_256x64x128x128_16x16_16x16_8x32x1_8x32x1_1x32x1x8_8_2x2_intrawave_v3
256,4,16384,16384,0,0,47.9976,a4w4_blockscale_256x64x128x128_16x16_16x16_8x32x1_8x32x1_1x32x1x8_8_2x2_intrawave_v3
256,4,106496,16384,0,0,171.6698,a4w4_blockscale_256x64x128x128_16x16_16x16_8x32x1_8x32x1_1x32x1x8_8_2x2_intrawave_v3
256,4,16384,53248,0,0,156.656,a4w4_blockscale_256x64x128x128_16x16_16x16_8x32x1_8x32x1_1x32x1x8_8_2x2_intrawave_v3
256,4,18432,16384,0,0,47.9528,a4w4_blockscale_256x64x128x128_16x16_16x16_8x32x1_8x32x1_1x32x1x8_8_2x2_intrawave_v3
256,8,16384,16384,0,0,47.6519,a4w4_blockscale_256x64x128x128_16x16_16x16_8x32x1_8x32x1_1x32x1x8_8_2x2_intrawave_v3
256,8,106496,16384,0,0,172.5446,a4w4_blockscale_256x64x128x128_16x16_16x16_8x32x1_8x32x1_1x32x1x8_8_2x2_intrawave_v3
256,8,16384,53248,0,0,157.2956,a4w4_blockscale_256x64x128x128_16x16_16x16_8x32x1_8x32x1_1x32x1x8_8_2x2_intrawave_v3
256,32,16384,16384,0,0,48.676,a4w4_blockscale_256x64x128x128_16x16_16x16_8x32x1_8x32x1_1x32x1x8_8_2x2_intrawave_v3
256,32,106496,16384,0,0,182.1863,a4w4_blockscale_256x64x128x128_16x16_16x16_8x32x1_8x32x1_1x32x1x8_8_2x2_intrawave_v3
256,64,106496,16384,3,0,200.4057,a4w4_blockscale_256x64x512x128_16x16_16x16_8x32x1_8x32x1_1x32x1x8_8_2x2_intrawave_v3
256,128,16384,16384,0,0,53.748,a4w4_blockscale_256x64x128x128_16x16_16x16_8x32x1_8x32x1_1x32x1x8_8_2x2_intrawave_v3
256,128,16384,53248,0,0,178.2259,a4w4_blockscale_256x64x128x128_16x16_16x16_8x32x1_8x32x1_1x32x1x8_8_2x2_intrawave_v3
256,256,16384,16384,1,0,71.1126,a4w4_blockscale_256x64x256x128_16x16_16x16_8x32x1_8x32x1_1x32x1x8_8_2x2_intrawave_v3
256,256,16384,53248,1,0,240.1914,a4w4_blockscale_256x64x256x128_16x16_16x16_8x32x1_8x32x1_1x32x1x8_8_2x2_intrawave_v3
256,256,18432,16384,2,0,97.5677,a4w4_blockscale_256x64x384x128_16x16_16x16_8x32x1_8x32x1_1x32x1x8_8_2x2_intrawave_v3
256,16384,16384,16384,7,0,3602.8224,a4w4_blockscale_256x96x512x128_16x16_16x16_8x32x1_8x32x1_1x32x1x8_8_2x2_intrawave_v3
256,16384,106496,16384,7,0,23937.2246,a4w4_blockscale_256x96x512x128_16x16_16x16_8x32x1_8x32x1_1x32x1x8_8_2x2_intrawave_v3
256,16384,16384,53248,7,0,11530.0392,a4w4_blockscale_256x96x512x128_16x16_16x16_8x32x1_8x32x1_1x32x1x8_8_2x2_intrawave_v3
256,16384,18432,16384,10,0,4031.1796,a4w4_blockscale_256x128x384x128_16x16_16x16_8x32x1_8x32x1_1x32x1x8_8_2x2_intrawave_v3
256,16,1536,7168,0,0,19.9248,a4w4_blockscale_256x64x128x128_16x16_16x16_8x32x1_8x32x1_1x32x1x8_8_2x2_intrawave_v3
256,16,3072,1536,0,0,7.0507,a4w4_blockscale_256x64x128x128_16x16_16x16_8x32x1_8x32x1_1x32x1x8_8_2x2_intrawave_v3
256,16,7168,2048,0,0,8.4447,a4w4_blockscale_256x64x128x128_16x16_16x16_8x32x1_8x32x1_1x32x1x8_8_2x2_intrawave_v3
256,16,4608,7168,0,0,22.3101,a4w4_blockscale_256x64x128x128_16x16_16x16_8x32x1_8x32x1_1x32x1x8_8_2x2_intrawave_v3
256,16,7168,2304,0,0,9.5571,a4w4_blockscale_256x64x128x128_16x16_16x16_8x32x1_8x32x1_1x32x1x8_8_2x2_intrawave_v3
256,16,512,7168,4,0,16.8692,a4w4_blockscale_256x96x128x128_16x16_16x16_8x32x1_8x32x1_1x32x1x8_8_2x2_intrawave_v3
256,32,1536,7168,0,0,20.0168,a4w4_blockscale_256x64x128x128_16x16_16x16_8x32x1_8x32x1_1x32x1x8_8_2x2_intrawave_v3
256,32,3072,1536,0,0,7.0107,a4w4_blockscale_256x64x128x128_16x16_16x16_8x32x1_8x32x1_1x32x1x8_8_2x2_intrawave_v3
256,32,7168,2048,0,0,8.5347,a4w4_blockscale_256x64x128x128_16x16_16x16_8x32x1_8x32x1_1x32x1x8_8_2x2_intrawave_v3
256,32,4608,7168,0,0,22.2165,a4w4_blockscale_256x64x128x128_16x16_16x16_8x32x1_8x32x1_1x32x1x8_8_2x2_intrawave_v3
256,32,7168,2304,0,0,9.7787,a4w4_blockscale_256x64x128x128_16x16_16x16_8x32x1_8x32x1_1x32x1x8_8_2x2_intrawave_v3
256,32,512,7168,4,0,17.0396,a4w4_blockscale_256x96x128x128_16x16_16x16_8x32x1_8x32x1_1x32x1x8_8_2x2_intrawave_v3
256,64,1536,7168,0,0,21.3441,a4w4_blockscale_256x64x128x128_16x16_16x16_8x32x1_8x32x1_1x32x1x8_8_2x2_intrawave_v3
256,64,3072,1536,0,0,7.2719,a4w4_blockscale_256x64x128x128_16x16_16x16_8x32x1_8x32x1_1x32x1x8_8_2x2_intrawave_v3
256,64,7168,2048,0,0,9.0279,a4w4_blockscale_256x64x128x128_16x16_16x16_8x32x1_8x32x1_1x32x1x8_8_2x2_intrawave_v3
256,64,4608,7168,0,0,23.1497,a4w4_blockscale_256x64x128x128_16x16_16x16_8x32x1_8x32x1_1x32x1x8_8_2x2_intrawave_v3
256,64,7168,2304,0,0,10.2539,a4w4_blockscale_256x64x128x128_16x16_16x16_8x32x1_8x32x1_1x32x1x8_8_2x2_intrawave_v3
256,64,512,7168,4,0,18.2008,a4w4_blockscale_256x96x128x128_16x16_16x16_8x32x1_8x32x1_1x32x1x8_8_2x2_intrawave_v3
256,128,1536,7168,0,0,23.4761,a4w4_blockscale_256x64x128x128_16x16_16x16_8x32x1_8x32x1_1x32x1x8_8_2x2_intrawave_v3
256,128,3072,1536,0,0,7.7123,a4w4_blockscale_256x64x128x128_16x16_16x16_8x32x1_8x32x1_1x32x1x8_8_2x2_intrawave_v3
256,128,7168,2048,0,0,9.3607,a4w4_blockscale_256x64x128x128_16x16_16x16_8x32x1_8x32x1_1x32x1x8_8_2x2_intrawave_v3
256,128,4608,7168,0,0,23.5505,a4w4_blockscale_256x64x128x128_16x16_16x16_8x32x1_8x32x1_1x32x1x8_8_2x2_intrawave_v3
256,128,7168,2304,0,0,10.3883,a4w4_blockscale_256x64x128x128_16x16_16x16_8x32x1_8x32x1_1x32x1x8_8_2x2_intrawave_v3
256,128,512,7168,0,0,22.7857,a4w4_blockscale_256x64x128x128_16x16_16x16_8x32x1_8x32x1_1x32x1x8_8_2x2_intrawave_v3
256,256,1536,7168,0,0,23.3033,a4w4_blockscale_256x64x128x128_16x16_16x16_8x32x1_8x32x1_1x32x1x8_8_2x2_intrawave_v3
256,256,3072,1536,0,0,8.0887,a4w4_blockscale_256x64x128x128_16x16_16x16_8x32x1_8x32x1_1x32x1x8_8_2x2_intrawave_v3
256,256,7168,2048,0,0,9.7515,a4w4_blockscale_256x64x128x128_16x16_16x16_8x32x1_8x32x1_1x32x1x8_8_2x2_intrawave_v3
256,256,4608,7168,0,0,23.7653,a4w4_blockscale_256x64x128x128_16x16_16x16_8x32x1_8x32x1_1x32x1x8_8_2x2_intrawave_v3
256,256,7168,2304,0,0,10.6915,a4w4_blockscale_256x64x128x128_16x16_16x16_8x32x1_8x32x1_1x32x1x8_8_2x2_intrawave_v3
256,256,512,7168,0,0,22.6525,a4w4_blockscale_256x64x128x128_16x16_16x16_8x32x1_8x32x1_1x32x1x8_8_2x2_intrawave_v3
256,512,1536,7168,0,0,23.7305,a4w4_blockscale_256x64x128x128_16x16_16x16_8x32x1_8x32x1_1x32x1x8_8_2x2_intrawave_v3
256,512,3072,1536,0,0,8.7335,a4w4_blockscale_256x64x128x128_16x16_16x16_8x32x1_8x32x1_1x32x1x8_8_2x2_intrawave_v3
256,512,7168,2048,1,0,13.0804,a4w4_blockscale_256x64x256x128_16x16_16x16_8x32x1_8x32x1_1x32x1x8_8_2x2_intrawave_v3
256,512,4608,7168,4,0,29.4314,a4w4_blockscale_256x96x128x128_16x16_16x16_8x32x1_8x32x1_1x32x1x8_8_2x2_intrawave_v3
256,512,7168,2304,8,0,12.9047,a4w4_blockscale_256x128x128x128_16x16_16x16_8x32x1_8x32x1_1x32x1x8_8_2x2_intrawave_v3
256,512,512,7168,0,0,23.2885,a4w4_blockscale_256x64x128x128_16x16_16x16_8x32x1_8x32x1_1x32x1x8_8_2x2_intrawave_v3
256,1024,1536,7168,0,0,25.4721,a4w4_blockscale_256x64x128x128_16x16_16x16_8x32x1_8x32x1_1x32x1x8_8_2x2_intrawave_v3
256,1024,3072,1536,8,0,10.7099,a4w4_blockscale_256x128x128x128_16x16_16x16_8x32x1_8x32x1_1x32x1x8_8_2x2_intrawave_v3
256,1024,7168,2048,8,0,19.98,a4w4_blockscale_256x128x128x128_16x16_16x16_8x32x1_8x32x1_1x32x1x8_8_2x2_intrawave_v3
256,1024,4608,7168,5,0,42.7675,a4w4_blockscale_256x96x256x128_16x16_16x16_8x32x1_8x32x1_1x32x1x8_8_2x2_intrawave_v3
256,1024,7168,2304,9,0,22.1345,a4w4_blockscale_256x128x256x128_16x16_16x16_8x32x1_8x32x1_1x32x1x8_8_2x2_intrawave_v3
256,1024,512,7168,0,0,24.5597,a4w4_blockscale_256x64x128x128_16x16_16x16_8x32x1_8x32x1_1x32x1x8_8_2x2_intrawave_v3
256,1536,1536,7168,4,0,29.9466,a4w4_blockscale_256x96x128x128_16x16_16x16_8x32x1_8x32x1_1x32x1x8_8_2x2_intrawave_v3
256,1536,3072,1536,4,0,12.9268,a4w4_blockscale_256x96x128x128_16x16_16x16_8x32x1_8x32x1_1x32x1x8_8_2x2_intrawave_v3
256,1536,7168,2048,10,0,26.9209,a4w4_blockscale_256x128x384x128_16x16_16x16_8x32x1_8x32x1_1x32x1x8_8_2x2_intrawave_v3
256,1536,4608,7168,6,0,54.4245,a4w4_blockscale_256x96x384x128_16x16_16x16_8x32x1_8x32x1_1x32x1x8_8_2x2_intrawave_v3
256,1536,7168,2304,7,0,29.4102,a4w4_blockscale_256x96x512x128_16x16_16x16_8x32x1_8x32x1_1x32x1x8_8_2x2_intrawave_v3
256,1536,512,7168,0,0,25.5821,a4w4_blockscale_256x64x128x128_16x16_16x16_8x32x1_8x32x1_1x32x1x8_8_2x2_intrawave_v3
256,2048,1536,7168,1,0,36.063,a4w4_blockscale_256x64x256x128_16x16_16x16_8x32x1_8x32x1_1x32x1x8_8_2x2_intrawave_v3
256,2048,3072,1536,9,0,16.228,a4w4_blockscale_256x128x256x128_16x16_16x16_8x32x1_8x32x1_1x32x1x8_8_2x2_intrawave_v3
256,2048,7168,2048,9,0,40.0639,a4w4_blockscale_256x128x256x128_16x16_16x16_8x32x1_8x32x1_1x32x1x8_8_2x2_intrawave_v3
256,2048,4608,7168,10,0,66.6546,a4w4_blockscale_256x128x384x128_16x16_16x16_8x32x1_8x32x1_1x32x1x8_8_2x2_intrawave_v3
256,2048,7168,2304,9,0,42.4075,a4w4_blockscale_256x128x256x128_16x16_16x16_8x32x1_8x32x1_1x32x1x8_8_2x2_intrawave_v3
256,2048,512,7168,0,0,26.4625,a4w4_blockscale_256x64x128x128_16x16_16x16_8x32x1_8x32x1_1x32x1x8_8_2x2_intrawave_v3
256,4096,1536,7168,2,0,50.4116,a4w4_blockscale_256x64x384x128_16x16_16x16_8x32x1_8x32x1_1x32x1x8_8_2x2_intrawave_v3
256,4096,3072,1536,10,0,28.6765,a4w4_blockscale_256x128x384x128_16x16_16x16_8x32x1_8x32x1_1x32x1x8_8_2x2_intrawave_v3
256,4096,7168,2048,10,0,77.5343,a4w4_blockscale_256x128x384x128_16x16_16x16_8x32x1_8x32x1_1x32x1x8_8_2x2_intrawave_v3
256,4096,4608,7168,10,0,131.1566,a4w4_blockscale_256x128x384x128_16x16_16x16_8x32x1_8x32x1_1x32x1x8_8_2x2_intrawave_v3
256,4096,7168,2304,5,0,80.8616,a4w4_blockscale_256x96x256x128_16x16_16x16_8x32x1_8x32x1_1x32x1x8_8_2x2_intrawave_v3
256,4096,512,7168,0,0,27.3037,a4w4_blockscale_256x64x128x128_16x16_16x16_8x32x1_8x32x1_1x32x1x8_8_2x2_intrawave_v3
256,8192,1536,7168,10,0,74.2943,a4w4_blockscale_256x128x384x128_16x16_16x16_8x32x1_8x32x1_1x32x1x8_8_2x2_intrawave_v3
256,8192,3072,1536,10,0,50.2556,a4w4_blockscale_256x128x384x128_16x16_16x16_8x32x1_8x32x1_1x32x1x8_8_2x2_intrawave_v3
256,8192,7168,2048,10,0,135.959,a4w4_blockscale_256x128x384x128_16x16_16x16_8x32x1_8x32x1_1x32x1x8_8_2x2_intrawave_v3
256,8192,4608,7168,10,0,227.7773,a4w4_blockscale_256x128x384x128_16x16_16x16_8x32x1_8x32x1_1x32x1x8_8_2x2_intrawave_v3
256,8192,7168,2304,10,0,145.1712,a4w4_blockscale_256x128x384x128_16x16_16x16_8x32x1_8x32x1_1x32x1x8_8_2x2_intrawave_v3
256,8192,512,7168,1,0,37.1971,a4w4_blockscale_256x64x256x128_16x16_16x16_8x32x1_8x32x1_1x32x1x8_8_2x2_intrawave_v3
256,16384,1536,7168,10,0,150.2504,a4w4_blockscale_256x128x384x128_16x16_16x16_8x32x1_8x32x1_1x32x1x8_8_2x2_intrawave_v3
256,16384,3072,1536,10,0,97.6538,a4w4_blockscale_256x128x384x128_16x16_16x16_8x32x1_8x32x1_1x32x1x8_8_2x2_intrawave_v3
256,16384,7168,2048,10,0,269.441,a4w4_blockscale_256x128x384x128_16x16_16x16_8x32x1_8x32x1_1x32x1x8_8_2x2_intrawave_v3
256,16384,4608,7168,10,0,454.2569,a4w4_blockscale_256x128x384x128_16x16_16x16_8x32x1_8x32x1_1x32x1x8_8_2x2_intrawave_v3
256,16384,7168,2304,10,0,288.9433,a4w4_blockscale_256x128x384x128_16x16_16x16_8x32x1_8x32x1_1x32x1x8_8_2x2_intrawave_v3
256,16384,512,7168,9,0,60.4461,a4w4_blockscale_256x128x256x128_16x16_16x16_8x32x1_8x32x1_1x32x1x8_8_2x2_intrawave_v3
256,20480,1536,7168,10,0,199.649,a4w4_blockscale_256x128x384x128_16x16_16x16_8x32x1_8x32x1_1x32x1x8_8_2x2_intrawave_v3
256,20480,3072,1536,10,0,118.3924,a4w4_blockscale_256x128x384x128_16x16_16x16_8x32x1_8x32x1_1x32x1x8_8_2x2_intrawave_v3
256,20480,7168,2048,10,0,333.465,a4w4_blockscale_256x128x384x128_16x16_16x16_8x32x1_8x32x1_1x32x1x8_8_2x2_intrawave_v3
256,20480,4608,7168,10,0,572.5215,a4w4_blockscale_256x128x384x128_16x16_16x16_8x32x1_8x32x1_1x32x1x8_8_2x2_intrawave_v3
256,20480,7168,2304,10,0,355.0349,a4w4_blockscale_256x128x384x128_16x16_16x16_8x32x1_8x32x1_1x32x1x8_8_2x2_intrawave_v3
256,20480,512,7168,7,0,72.5979,a4w4_blockscale_256x96x512x128_16x16_16x16_8x32x1_8x32x1_1x32x1x8_8_2x2_intrawave_v3
256,1,1280,8192,0,0,20.0932,a4w4_blockscale_256x64x128x128_16x16_16x16_8x32x1_8x32x1_1x32x1x8_8_2x2_intrawave_v3
256,64,1280,8192,0,0,23.0153,a4w4_blockscale_256x64x128x128_16x16_16x16_8x32x1_8x32x1_1x32x1x8_8_2x2_intrawave_v3
256,127,1280,8192,0,0,24.5329,a4w4_blockscale_256x64x128x128_16x16_16x16_8x32x1_8x32x1_1x32x1x8_8_2x2_intrawave_v3
256,129,1280,8192,0,0,24.2013,a4w4_blockscale_256x64x128x128_16x16_16x16_8x32x1_8x32x1_1x32x1x8_8_2x2_intrawave_v3
256,65,1280,8192,0,0,23.9233,a4w4_blockscale_256x64x128x128_16x16_16x16_8x32x1_8x32x1_1x32x1x8_8_2x2_intrawave_v3
256,32,1280,8192,0,0,20.6788,a4w4_blockscale_256x64x128x128_16x16_16x16_8x32x1_8x32x1_1x32x1x8_8_2x2_intrawave_v3
256,128,1280,8192,0,0,24.6385,a4w4_blockscale_256x64x128x128_16x16_16x16_8x32x1_8x32x1_1x32x1x8_8_2x2_intrawave_v3
256,192,1280,8192,0,0,24.7873,a4w4_blockscale_256x64x128x128_16x16_16x16_8x32x1_8x32x1_1x32x1x8_8_2x2_intrawave_v3
256,256,1280,8192,0,0,25.0285,a4w4_blockscale_256x64x128x128_16x16_16x16_8x32x1_8x32x1_1x32x1x8_8_2x2_intrawave_v3
256,320,1280,8192,0,0,25.6077,a4w4_blockscale_256x64x128x128_16x16_16x16_8x32x1_8x32x1_1x32x1x8_8_2x2_intrawave_v3
256,512,1280,8192,0,0,25.7465,a4w4_blockscale_256x64x128x128_16x16_16x16_8x32x1_8x32x1_1x32x1x8_8_2x2_intrawave_v3
256,1024,1280,8192,0,0,26.7393,a4w4_blockscale_256x64x128x128_16x16_16x16_8x32x1_8x32x1_1x32x1x8_8_2x2_intrawave_v3
256,2048,1280,8192,4,0,35.2002,a4w4_blockscale_256x96x128x128_16x16_16x16_8x32x1_8x32x1_1x32x1x8_8_2x2_intrawave_v3
256,4096,1280,8192,5,0,50.0176,a4w4_blockscale_256x96x256x128_16x16_16x16_8x32x1_8x32x1_1x32x1x8_8_2x2_intrawave_v3
256,8192,1280,8192,10,0,81.1756,a4w4_blockscale_256x128x384x128_16x16_16x16_8x32x1_8x32x1_1x32x1x8_8_2x2_intrawave_v3
256,1,8192,1024,0,0,6.2531,a4w4_blockscale_256x64x128x128_16x16_16x16_8x32x1_8x32x1_1x32x1x8_8_2x2_intrawave_v3
256,32,8192,1024,0,0,6.2023,a4w4_blockscale_256x64x128x128_16x16_16x16_8x32x1_8x32x1_1x32x1x8_8_2x2_intrawave_v3
256,64,8192,1024,0,0,6.7819,a4w4_blockscale_256x64x128x128_16x16_16x16_8x32x1_8x32x1_1x32x1x8_8_2x2_intrawave_v3
256,128,8192,1024,0,0,6.9383,a4w4_blockscale_256x64x128x128_16x16_16x16_8x32x1_8x32x1_1x32x1x8_8_2x2_intrawave_v3
256,192,8192,1024,0,0,7.1247,a4w4_blockscale_256x64x128x128_16x16_16x16_8x32x1_8x32x1_1x32x1x8_8_2x2_intrawave_v3
256,256,8192,1024,0,0,7.3495,a4w4_blockscale_256x64x128x128_16x16_16x16_8x32x1_8x32x1_1x32x1x8_8_2x2_intrawave_v3
256,320,8192,1024,4,0,8.2715,a4w4_blockscale_256x96x128x128_16x16_16x16_8x32x1_8x32x1_1x32x1x8_8_2x2_intrawave_v3
256,512,8192,1024,1,0,9.6435,a4w4_blockscale_256x64x256x128_16x16_16x16_8x32x1_8x32x1_1x32x1x8_8_2x2_intrawave_v3
256,1024,8192,1024,9,0,15.072,a4w4_blockscale_256x128x256x128_16x16_16x16_8x32x1_8x32x1_1x32x1x8_8_2x2_intrawave_v3
256,2048,8192,1024,9,0,29.6818,a4w4_blockscale_256x128x256x128_16x16_16x16_8x32x1_8x32x1_1x32x1x8_8_2x2_intrawave_v3
256,4096,8192,1024,10,0,56.4649,a4w4_blockscale_256x128x384x128_16x16_16x16_8x32x1_8x32x1_1x32x1x8_8_2x2_intrawave_v3
256,8192,8192,1024,10,0,109.9155,a4w4_blockscale_256x128x384x128_16x16_16x16_8x32x1_8x32x1_1x32x1x8_8_2x2_intrawave_v3
256,16384,8192,1024,11,0,138.2206,a4w4_blockscale_256x128x512x128_16x16_16x16_8x32x1_8x32x1_1x32x1x8_8_2x2_intrawave_v3
256,1552,57344,8192,21,0,402.0203,_ZN5aiter42f4gemm_bf16_per1x32Fp4_BpreShuffle_128x512E
256,1664,57344,8192,21,0,410.6409,_ZN5aiter42f4gemm_bf16_per1x32Fp4_BpreShuffle_128x512E
256,1792,57344,8192,26,0,432.9381,_ZN5aiter42f4gemm_bf16_per1x32Fp4_BpreShuffle_224x256E
256,1920,57344,8192,21,0,476.6147,_ZN5aiter42f4gemm_bf16_per1x32Fp4_BpreShuffle_128x512E
256,2048,57344,8192,21,0,481.0754,_ZN5aiter42f4gemm_bf16_per1x32Fp4_BpreShuffle_128x512E
256,3072,57344,8192,21,0,735.2449,_ZN5aiter42f4gemm_bf16_per1x32Fp4_BpreShuffle_128x512E
256,4096,57344,8192,21,0,935.7208,_ZN5aiter42f4gemm_bf16_per1x32Fp4_BpreShuffle_128x512E
256,32768,57344,8192,27,0,6974.528,_ZN5aiter42f4gemm_bf16_per1x32Fp4_BpreShuffle_256x256E
256,1,2560,8192,14,0,20.1935,a4w4_blockscale_256x32x128x128_16x16_16x16_8x32x1_8x32x1_1x16x1x16_8_2x2_intrawave_v3
256,1,7168,8192,14,0,20.9682,a4w4_blockscale_256x32x128x128_16x16_16x16_8x32x1_8x32x1_1x16x1x16_8_2x2_intrawave_v3
256,1,8192,2048,14,0,7.88,a4w4_blockscale_256x32x128x128_16x16_16x16_8x32x1_8x32x1_1x16x1x16_8_2x2_intrawave_v3
256,1,8192,3584,14,0,11.7177,a4w4_blockscale_256x32x128x128_16x16_16x16_8x32x1_8x32x1_1x16x1x16_8_2x2_intrawave_v3
256,1,8192,7168,14,0,20.4814,a4w4_blockscale_256x32x128x128_16x16_16x16_8x32x1_8x32x1_1x16x1x16_8_2x2_intrawave_v3
256,1,8192,8192,14,0,21.1499,a4w4_blockscale_256x32x128x128_16x16_16x16_8x32x1_8x32x1_1x16x1x16_8_2x2_intrawave_v3
256,1,8192,28672,14,0,70.6455,a4w4_blockscale_256x32x128x128_16x16_16x16_8x32x1_8x32x1_1x16x1x16_8_2x2_intrawave_v3
256,1,10240,8192,14,0,21.4492,a4w4_blockscale_256x32x128x128_16x16_16x16_8x32x1_8x32x1_1x16x1x16_8_2x2_intrawave_v3
256,1,14336,8192,14,0,22.2254,a4w4_blockscale_256x32x128x128_16x16_16x16_8x32x1_8x32x1_1x16x1x16_8_2x2_intrawave_v3
256,1,57344,8192,0,0,44.9349,a4w4_blockscale_256x64x128x128_16x16_16x16_8x32x1_8x32x1_1x32x1x8_8_2x2_intrawave_v3
256,16,1280,8192,14,0,17.8843,a4w4_blockscale_256x32x128x128_16x16_16x16_8x32x1_8x32x1_1x16x1x16_8_2x2_intrawave_v3
256,16,2560,8192,14,0,20.3303,a4w4_blockscale_256x32x128x128_16x16_16x16_8x32x1_8x32x1_1x16x1x16_8_2x2_intrawave_v3
256,16,7168,8192,14,0,21.0998,a4w4_blockscale_256x32x128x128_16x16_16x16_8x32x1_8x32x1_1x16x1x16_8_2x2_intrawave_v3
256,16,8192,1024,14,0,5.286,a4w4_blockscale_256x32x128x128_16x16_16x16_8x32x1_8x32x1_1x16x1x16_8_2x2_intrawave_v3
256,16,8192,2048,14,0,7.4009,a4w4_blockscale_256x32x128x128_16x16_16x16_8x32x1_8x32x1_1x16x1x16_8_2x2_intrawave_v3
256,16,8192,3584,14,0,11.681,a4w4_blockscale_256x32x128x128_16x16_16x16_8x32x1_8x32x1_1x16x1x16_8_2x2_intrawave_v3
256,16,8192,7168,14,0,20.7064,a4w4_blockscale_256x32x128x128_16x16_16x16_8x32x1_8x32x1_1x16x1x16_8_2x2_intrawave_v3
256,16,8192,8192,14,0,21.2878,a4w4_blockscale_256x32x128x128_16x16_16x16_8x32x1_8x32x1_1x16x1x16_8_2x2_intrawave_v3
256,16,8192,28672,14,0,71.0134,a4w4_blockscale_256x32x128x128_16x16_16x16_8x32x1_8x32x1_1x16x1x16_8_2x2_intrawave_v3
256,16,10240,8192,14,0,21.5887,a4w4_blockscale_256x32x128x128_16x16_16x16_8x32x1_8x32x1_1x16x1x16_8_2x2_intrawave_v3
256,16,14336,8192,14,0,22.4535,a4w4_blockscale_256x32x128x128_16x16_16x16_8x32x1_8x32x1_1x16x1x16_8_2x2_intrawave_v3
256,16,57344,8192,14,0,45.8599,a4w4_blockscale_256x32x128x128_16x16_16x16_8x32x1_8x32x1_1x16x1x16_8_2x2_intrawave_v3
256,32,2560,8192,14,0,20.3987,a4w4_blockscale_256x32x128x128_16x16_16x16_8x32x1_8x32x1_1x16x1x16_8_2x2_intrawave_v3
256,32,7168,8192,14,0,21.138,a4w4_blockscale_256x32x128x128_16x16_16x16_8x32x1_8x32x1_1x16x1x16_8_2x2_intrawave_v3
256,32,8192,2048,12,0,7.9311,a4w4_blockscale_256x64x128x128_16x16_16x16_8x32x1_8x32x1_1x16x1x16_8_2x2_intrawave_v3
256,32,8192,3584,14,0,12.4795,a4w4_blockscale_256x32x128x128_16x16_16x16_8x32x1_8x32x1_1x16x1x16_8_2x2_intrawave_v3
256,32,8192,7168,14,0,20.6638,a4w4_blockscale_256x32x128x128_16x16_16x16_8x32x1_8x32x1_1x16x1x16_8_2x2_intrawave_v3
256,32,8192,8192,14,0,21.3503,a4w4_blockscale_256x32x128x128_16x16_16x16_8x32x1_8x32x1_1x16x1x16_8_2x2_intrawave_v3
256,32,8192,28672,14,0,71.1556,a4w4_blockscale_256x32x128x128_16x16_16x16_8x32x1_8x32x1_1x16x1x16_8_2x2_intrawave_v3
256,32,10240,8192,14,0,21.6194,a4w4_blockscale_256x32x128x128_16x16_16x16_8x32x1_8x32x1_1x16x1x16_8_2x2_intrawave_v3
256,32,14336,8192,14,0,22.5861,a4w4_blockscale_256x32x128x128_16x16_16x16_8x32x1_8x32x1_1x16x1x16_8_2x2_intrawave_v3
256,32,57344,8192,15,0,46.7083,a4w4_blockscale_256x32x256x128_16x16_16x16_8x32x1_8x32x1_1x8x1x32_8_2x4_intrawave_v3
256,64,192,1024,19,0,13.2008,a4w4_blockscale_256x256x256x128_16x16_16x16_8x32x1_8x32x1_1x8x1x32_8_2x8_intrawave_v3
256,64,2560,8192,14,0,20.9571,a4w4_blockscale_256x32x128x128_16x16_16x16_8x32x1_8x32x1_1x16x1x16_8_2x2_intrawave_v3
256,64,7168,8192,14,0,20.3909,a4w4_blockscale_256x32x128x128_16x16_16x16_8x32x1_8x32x1_1x16x1x16_8_2x2_intrawave_v3
256,64,8192,2048,14,0,7.542,a4w4_blockscale_256x32x128x128_16x16_16x16_8x32x1_8x32x1_1x16x1x16_8_2x2_intrawave_v3
256,64,8192,3584,14,0,12.5971,a4w4_blockscale_256x32x128x128_16x16_16x16_8x32x1_8x32x1_1x16x1x16_8_2x2_intrawave_v3
256,64,8192,7168,14,0,20.12,a4w4_blockscale_256x32x128x128_16x16_16x16_8x32x1_8x32x1_1x16x1x16_8_2x2_intrawave_v3
256,64,8192,8192,14,0,20.4294,a4w4_blockscale_256x32x128x128_16x16_16x16_8x32x1_8x32x1_1x16x1x16_8_2x2_intrawave_v3
256,64,8192,28672,14,0,69.6281,a4w4_blockscale_256x32x128x128_16x16_16x16_8x32x1_8x32x1_1x16x1x16_8_2x2_intrawave_v3
256,64,10240,8192,14,0,21.1196,a4w4_blockscale_256x32x128x128_16x16_16x16_8x32x1_8x32x1_1x16x1x16_8_2x2_intrawave_v3
256,64,14336,8192,14,0,21.9162,a4w4_blockscale_256x32x128x128_16x16_16x16_8x32x1_8x32x1_1x16x1x16_8_2x2_intrawave_v3
256,64,57344,8192,0,0,48.7005,a4w4_blockscale_256x64x128x128_16x16_16x16_8x32x1_8x32x1_1x32x1x8_8_2x2_intrawave_v3
256,128,2560,8192,14,0,20.4281,a4w4_blockscale_256x32x128x128_16x16_16x16_8x32x1_8x32x1_1x16x1x16_8_2x2_intrawave_v3
256,128,7168,8192,14,0,20.1978,a4w4_blockscale_256x32x128x128_16x16_16x16_8x32x1_8x32x1_1x16x1x16_8_2x2_intrawave_v3
256,128,8192,2048,14,0,7.7839,a4w4_blockscale_256x32x128x128_16x16_16x16_8x32x1_8x32x1_1x16x1x16_8_2x2_intrawave_v3
256,128,8192,3584,14,0,11.665,a4w4_blockscale_256x32x128x128_16x16_16x16_8x32x1_8x32x1_1x16x1x16_8_2x2_intrawave_v3
256,128,8192,7168,14,0,19.6172,a4w4_blockscale_256x32x128x128_16x16_16x16_8x32x1_8x32x1_1x16x1x16_8_2x2_intrawave_v3
256,128,8192,8192,14,0,20.1687,a4w4_blockscale_256x32x128x128_16x16_16x16_8x32x1_8x32x1_1x16x1x16_8_2x2_intrawave_v3
256,128,8192,28672,14,0,67.8423,a4w4_blockscale_256x32x128x128_16x16_16x16_8x32x1_8x32x1_1x16x1x16_8_2x2_intrawave_v3
256,128,10240,8192,14,0,23.8897,a4w4_blockscale_256x32x128x128_16x16_16x16_8x32x1_8x32x1_1x16x1x16_8_2x2_intrawave_v3
256,128,14336,8192,14,0,24.8973,a4w4_blockscale_256x32x128x128_16x16_16x16_8x32x1_8x32x1_1x16x1x16_8_2x2_intrawave_v3
256,128,57344,8192,9,0,52.789,a4w4_blockscale_256x128x256x128_16x16_16x16_8x32x1_8x32x1_1x32x1x8_8_2x2_intrawave_v3
256,256,2560,8192,14,0,20.5719,a4w4_blockscale_256x32x128x128_16x16_16x16_8x32x1_8x32x1_1x16x1x16_8_2x2_intrawave_v3
256,256,7168,8192,12,0,23.699,a4w4_blockscale_256x64x128x128_16x16_16x16_8x32x1_8x32x1_1x16x1x16_8_2x2_intrawave_v3
256,256,8192,2048,0,0,8.8946,a4w4_blockscale_256x64x128x128_16x16_16x16_8x32x1_8x32x1_1x32x1x8_8_2x2_intrawave_v3
256,256,8192,3584,12,0,13.2343,a4w4_blockscale_256x64x128x128_16x16_16x16_8x32x1_8x32x1_1x16x1x16_8_2x2_intrawave_v3
256,256,8192,7168,12,0,22.9609,a4w4_blockscale_256x64x128x128_16x16_16x16_8x32x1_8x32x1_1x16x1x16_8_2x2_intrawave_v3
256,256,8192,8192,0,0,23.9886,a4w4_blockscale_256x64x128x128_16x16_16x16_8x32x1_8x32x1_1x32x1x8_8_2x2_intrawave_v3
256,256,8192,28672,12,0,79.9059,a4w4_blockscale_256x64x128x128_16x16_16x16_8x32x1_8x32x1_1x16x1x16_8_2x2_intrawave_v3
256,256,10240,8192,4,0,25.5341,a4w4_blockscale_256x96x128x128_16x16_16x16_8x32x1_8x32x1_1x32x1x8_8_2x2_intrawave_v3
256,256,14336,8192,8,0,28.0357,a4w4_blockscale_256x128x128x128_16x16_16x16_8x32x1_8x32x1_1x32x1x8_8_2x2_intrawave_v3
256,256,57344,8192,24,0,70.5175,_ZN5aiter42f4gemm_bf16_per1x32Fp4_BpreShuffle_256x256E
256,512,2560,8192,12,0,23.8055,a4w4_blockscale_256x64x128x128_16x16_16x16_8x32x1_8x32x1_1x16x1x16_8_2x2_intrawave_v3
256,512,7168,8192,8,0,27.6576,a4w4_blockscale_256x128x128x128_16x16_16x16_8x32x1_8x32x1_1x32x1x8_8_2x2_intrawave_v3
256,512,8192,2048,8,0,10.7791,a4w4_blockscale_256x128x128x128_16x16_16x16_8x32x1_8x32x1_1x32x1x8_8_2x2_intrawave_v3
256,512,8192,3584,8,0,15.4143,a4w4_blockscale_256x128x128x128_16x16_16x16_8x32x1_8x32x1_1x32x1x8_8_2x2_intrawave_v3
256,512,8192,7168,8,0,26.3508,a4w4_blockscale_256x128x128x128_16x16_16x16_8x32x1_8x32x1_1x32x1x8_8_2x2_intrawave_v3
256,512,8192,8192,8,0,28.446,a4w4_blockscale_256x128x128x128_16x16_16x16_8x32x1_8x32x1_1x32x1x8_8_2x2_intrawave_v3
256,512,8192,28672,8,0,88.4322,a4w4_blockscale_256x128x128x128_16x16_16x16_8x32x1_8x32x1_1x32x1x8_8_2x2_intrawave_v3
256,512,10240,8192,9,0,37.3399,a4w4_blockscale_256x128x256x128_16x16_16x16_8x32x1_8x32x1_1x32x1x8_8_2x2_intrawave_v3
256,512,14336,8192,9,0,40.1157,a4w4_blockscale_256x128x256x128_16x16_16x16_8x32x1_8x32x1_1x32x1x8_8_2x2_intrawave_v3
256,512,57344,8192,18,0,125.5765,a4w4_blockscale_256x256x256x128_16x16_16x16_8x32x1_8x32x1_1x8x1x32_8_2x4_intrawave_v3
256,1024,2560,8192,4,0,26.3517,a4w4_blockscale_256x96x128x128_16x16_16x16_8x32x1_8x32x1_1x32x1x8_8_2x2_intrawave_v3
256,1024,7168,8192,9,0,41.0141,a4w4_blockscale_256x128x256x128_16x16_16x16_8x32x1_8x32x1_1x32x1x8_8_2x2_intrawave_v3
256,1024,8192,2048,8,0,16.3364,a4w4_blockscale_256x128x128x128_16x16_16x16_8x32x1_8x32x1_1x32x1x8_8_2x2_intrawave_v3
256,1024,8192,3584,9,0,23.3284,a4w4_blockscale_256x128x256x128_16x16_16x16_8x32x1_8x32x1_1x32x1x8_8_2x2_intrawave_v3
256,1024,8192,7168,9,0,38.7665,a4w4_blockscale_256x128x256x128_16x16_16x16_8x32x1_8x32x1_1x32x1x8_8_2x2_intrawave_v3
256,1024,8192,8192,9,0,42.7765,a4w4_blockscale_256x128x256x128_16x16_16x16_8x32x1_8x32x1_1x32x1x8_8_2x2_intrawave_v3
256,1024,8192,28672,22,0,126.0662,_ZN5aiter42f4gemm_bf16_per1x32Fp4_BpreShuffle_192x256E
256,1024,10240,8192,22,0,47.0693,_ZN5aiter42f4gemm_bf16_per1x32Fp4_BpreShuffle_192x256E
256,1024,14336,8192,24,0,55.6742,_ZN5aiter42f4gemm_bf16_per1x32Fp4_BpreShuffle_256x256E
256,1024,57344,8192,18,0,238.8419,a4w4_blockscale_256x256x256x128_16x16_16x16_8x32x1_8x32x1_1x8x1x32_8_2x4_intrawave_v3
256,2048,2560,8192,22,0,38.4519,_ZN5aiter42f4gemm_bf16_per1x32Fp4_BpreShuffle_192x256E
256,2048,7168,8192,24,0,56.2618,_ZN5aiter42f4gemm_bf16_per1x32Fp4_BpreShuffle_256x256E
256,2048,8192,2048,24,0,21.4821,_ZN5aiter42f4gemm_bf16_per1x32Fp4_BpreShuffle_256x256E
256,2048,8192,3584,24,0,31.9644,_ZN5aiter42f4gemm_bf16_per1x32Fp4_BpreShuffle_256x256E
256,2048,8192,7168,24,0,54.267,_ZN5aiter42f4gemm_bf16_per1x32Fp4_BpreShuffle_256x256E
256,2048,8192,8192,24,0,60.453,_ZN5aiter42f4gemm_bf16_per1x32Fp4_BpreShuffle_256x256E
256,2048,8192,28672,24,0,172.7778,_ZN5aiter42f4gemm_bf16_per1x32Fp4_BpreShuffle_256x256E
256,2048,10240,8192,22,0,91.1052,_ZN5aiter42f4gemm_bf16_per1x32Fp4_BpreShuffle_192x256E
256,2048,14336,8192,24,0,107.3856,_ZN5aiter42f4gemm_bf16_per1x32Fp4_BpreShuffle_256x256E
256,4096,2560,8192,22,0,49.0685,_ZN5aiter42f4gemm_bf16_per1x32Fp4_BpreShuffle_192x256E
256,4096,7168,8192,24,0,110.7698,_ZN5aiter42f4gemm_bf16_per1x32Fp4_BpreShuffle_256x256E
256,4096,8192,2048,24,0,42.5533,_ZN5aiter42f4gemm_bf16_per1x32Fp4_BpreShuffle_256x256E
256,4096,8192,3584,24,0,62.221,_ZN5aiter42f4gemm_bf16_per1x32Fp4_BpreShuffle_256x256E
256,4096,8192,7168,24,0,102.5193,_ZN5aiter42f4gemm_bf16_per1x32Fp4_BpreShuffle_256x256E
256,4096,8192,8192,24,0,114.6354,_ZN5aiter42f4gemm_bf16_per1x32Fp4_BpreShuffle_256x256E
256,4096,8192,28672,24,0,336.8039,_ZN5aiter42f4gemm_bf16_per1x32Fp4_BpreShuffle_256x256E
256,4096,10240,8192,24,0,151.2279,_ZN5aiter42f4gemm_bf16_per1x32Fp4_BpreShuffle_256x256E
256,4096,14336,8192,24,0,203.4186,_ZN5aiter42f4gemm_bf16_per1x32Fp4_BpreShuffle_256x256E
256,8192,2560,8192,22,0,92.642,_ZN5aiter42f4gemm_bf16_per1x32Fp4_BpreShuffle_192x256E
256,8192,7168,8192,24,0,208.9117,_ZN5aiter42f4gemm_bf16_per1x32Fp4_BpreShuffle_256x256E
256,8192,8192,2048,24,0,82.6092,_ZN5aiter42f4gemm_bf16_per1x32Fp4_BpreShuffle_256x256E
256,8192,8192,3584,24,0,120.6525,_ZN5aiter42f4gemm_bf16_per1x32Fp4_BpreShuffle_256x256E
256,8192,8192,7168,24,0,194.4947,_ZN5aiter42f4gemm_bf16_per1x32Fp4_BpreShuffle_256x256E
256,8192,8192,8192,24,0,216.7585,_ZN5aiter42f4gemm_bf16_per1x32Fp4_BpreShuffle_256x256E
256,8192,8192,28672,24,0,657.763,_ZN5aiter42f4gemm_bf16_per1x32Fp4_BpreShuffle_256x256E
256,8192,10240,8192,24,0,276.5124,_ZN5aiter42f4gemm_bf16_per1x32Fp4_BpreShuffle_256x256E
256,8192,14336,8192,24,0,379.047,_ZN5aiter42f4gemm_bf16_per1x32Fp4_BpreShuffle_256x256E
256,8192,57344,8192,24,0,1507.5194,_ZN5aiter42f4gemm_bf16_per1x32Fp4_BpreShuffle_256x256E
256,16384,1280,8192,22,0,97.1819,_ZN5aiter42f4gemm_bf16_per1x32Fp4_BpreShuffle_192x256E
256,16384,2560,8192,23,0,161.8489,_ZN5aiter42f4gemm_bf16_per1x32Fp4_BpreShuffle_224x256E
256,16384,7168,8192,24,0,387.9259,_ZN5aiter42f4gemm_bf16_per1x32Fp4_BpreShuffle_256x256E
256,16384,8192,2048,24,0,158.7577,_ZN5aiter42f4gemm_bf16_per1x32Fp4_BpreShuffle_256x256E
256,16384,8192,3584,24,0,223.8924,_ZN5aiter42f4gemm_bf16_per1x32Fp4_BpreShuffle_256x256E
256,16384,8192,7168,24,0,380.1193,_ZN5aiter42f4gemm_bf16_per1x32Fp4_BpreShuffle_256x256E
256,16384,8192,8192,24,0,429.3727,_ZN5aiter42f4gemm_bf16_per1x32Fp4_BpreShuffle_256x256E
256,16384,8192,28672,24,0,1330.9626,_ZN5aiter42f4gemm_bf16_per1x32Fp4_BpreShuffle_256x256E
256,16384,10240,8192,24,0,546.9175,_ZN5aiter42f4gemm_bf16_per1x32Fp4_BpreShuffle_256x256E
256,16384,14336,8192,24,0,754.7949,_ZN5aiter42f4gemm_bf16_per1x32Fp4_BpreShuffle_256x256E
256,16384,57344,8192,24,0,2964.3928,_ZN5aiter42f4gemm_bf16_per1x32Fp4_BpreShuffle_256x256E
256,32768,1280,8192,21,0,167.9341,_ZN5aiter42f4gemm_bf16_per1x32Fp4_BpreShuffle_128x512E
256,32768,2560,8192,21,0,287.488,_ZN5aiter42f4gemm_bf16_per1x32Fp4_BpreShuffle_128x512E
256,32768,7168,8192,24,0,785.8103,_ZN5aiter42f4gemm_bf16_per1x32Fp4_BpreShuffle_256x256E
256,32768,8192,1024,21,0,216.4753,_ZN5aiter42f4gemm_bf16_per1x32Fp4_BpreShuffle_128x512E
256,32768,8192,2048,24,0,308.4436,_ZN5aiter42f4gemm_bf16_per1x32Fp4_BpreShuffle_256x256E
256,32768,8192,3584,24,0,447.0983,_ZN5aiter42f4gemm_bf16_per1x32Fp4_BpreShuffle_256x256E
256,32768,8192,7168,24,0,774.6206,_ZN5aiter42f4gemm_bf16_per1x32Fp4_BpreShuffle_256x256E
256,32768,8192,8192,24,0,854.7832,_ZN5aiter42f4gemm_bf16_per1x32Fp4_BpreShuffle_256x256E
256,32768,8192,28672,21,0,2661.9311,_ZN5aiter42f4gemm_bf16_per1x32Fp4_BpreShuffle_128x512E
256,32768,10240,8192,21,0,1095.985,_ZN5aiter42f4gemm_bf16_per1x32Fp4_BpreShuffle_128x512E
256,32768,14336,8192,24,0,1518.3699,_ZN5aiter42f4gemm_bf16_per1x32Fp4_BpreShuffle_256x256E
256,1,2304,16384,22,0,54.228,_ZN5aiter42f4gemm_bf16_per1x32Fp4_BpreShuffle_192x256E
256,1,4608,16384,22,0,54.8285,_ZN5aiter42f4gemm_bf16_per1x32Fp4_BpreShuffle_192x256E
256,1,9216,16384,22,0,55.6692,_ZN5aiter42f4gemm_bf16_per1x32Fp4_BpreShuffle_192x256E
256,1,13312,16384,22,0,56.3998,_ZN5aiter42f4gemm_bf16_per1x32Fp4_BpreShuffle_192x256E
256,1,16384,2048,22,0,13.1755,_ZN5aiter42f4gemm_bf16_per1x32Fp4_BpreShuffle_192x256E
256,1,16384,4096,22,0,19.7349,_ZN5aiter42f4gemm_bf16_per1x32Fp4_BpreShuffle_192x256E
256,1,16384,6656,22,0,27.4026,_ZN5aiter42f4gemm_bf16_per1x32Fp4_BpreShuffle_192x256E
256,1,16384,8192,22,0,32.0702,_ZN5aiter42f4gemm_bf16_per1x32Fp4_BpreShuffle_192x256E
256,1,16384,13312,22,0,48.2762,_ZN5aiter42f4gemm_bf16_per1x32Fp4_BpreShuffle_192x256E
256,1,16384,26624,22,0,88.8555,_ZN5aiter42f4gemm_bf16_per1x32Fp4_BpreShuffle_192x256E
256,1,26624,16384,22,0,67.635,_ZN5aiter42f4gemm_bf16_per1x32Fp4_BpreShuffle_192x256E
256,1,53248,16384,23,0,93.552,_ZN5aiter42f4gemm_bf16_per1x32Fp4_BpreShuffle_224x256E
256,16,2304,16384,22,0,54.497,_ZN5aiter42f4gemm_bf16_per1x32Fp4_BpreShuffle_192x256E
256,16,4608,16384,22,0,55.1294,_ZN5aiter42f4gemm_bf16_per1x32Fp4_BpreShuffle_192x256E
256,16,9216,16384,22,0,56.0213,_ZN5aiter42f4gemm_bf16_per1x32Fp4_BpreShuffle_192x256E
256,16,13312,16384,22,0,57.3288,_ZN5aiter42f4gemm_bf16_per1x32Fp4_BpreShuffle_192x256E
256,16,16384,2048,22,0,13.5196,_ZN5aiter42f4gemm_bf16_per1x32Fp4_BpreShuffle_192x256E
256,16,16384,4096,22,0,20.1525,_ZN5aiter42f4gemm_bf16_per1x32Fp4_BpreShuffle_192x256E
256,16,16384,6656,22,0,27.8764,_ZN5aiter42f4gemm_bf16_per1x32Fp4_BpreShuffle_192x256E
256,16,16384,8192,22,0,32.3757,_ZN5aiter42f4gemm_bf16_per1x32Fp4_BpreShuffle_192x256E
256,16,16384,13312,22,0,48.4342,_ZN5aiter42f4gemm_bf16_per1x32Fp4_BpreShuffle_192x256E
256,16,16384,26624,22,0,88.5627,_ZN5aiter42f4gemm_bf16_per1x32Fp4_BpreShuffle_192x256E
256,16,26624,16384,22,0,67.8006,_ZN5aiter42f4gemm_bf16_per1x32Fp4_BpreShuffle_192x256E
256,16,53248,16384,23,0,90.25,_ZN5aiter42f4gemm_bf16_per1x32Fp4_BpreShuffle_224x256E
256,32,2304,16384,22,0,57.4695,_ZN5aiter42f4gemm_bf16_per1x32Fp4_BpreShuffle_192x256E
256,32,4608,16384,22,0,58.335,_ZN5aiter42f4gemm_bf16_per1x32Fp4_BpreShuffle_192x256E
256,32,9216,16384,22,0,60.2896,_ZN5aiter42f4gemm_bf16_per1x32Fp4_BpreShuffle_192x256E
256,32,13312,16384,22,0,61.121,_ZN5aiter42f4gemm_bf16_per1x32Fp4_BpreShuffle_192x256E
256,32,16384,2048,22,0,14.0172,_ZN5aiter42f4gemm_bf16_per1x32Fp4_BpreShuffle_192x256E
256,32,16384,4096,22,0,21.0909,_ZN5aiter42f4gemm_bf16_per1x32Fp4_BpreShuffle_192x256E
256,32,16384,6656,22,0,28.5672,_ZN5aiter42f4gemm_bf16_per1x32Fp4_BpreShuffle_192x256E
256,32,16384,8192,22,0,34.3324,_ZN5aiter42f4gemm_bf16_per1x32Fp4_BpreShuffle_192x256E
256,32,16384,13312,22,0,51.6938,_ZN5aiter42f4gemm_bf16_per1x32Fp4_BpreShuffle_192x256E
256,32,16384,26624,22,0,95.9257,_ZN5aiter42f4gemm_bf16_per1x32Fp4_BpreShuffle_192x256E
256,32,26624,16384,22,0,66.3483,_ZN5aiter42f4gemm_bf16_per1x32Fp4_BpreShuffle_192x256E
256,32,53248,16384,22,0,90.8983,_ZN5aiter42f4gemm_bf16_per1x32Fp4_BpreShuffle_192x256E
256,64,2304,16384,22,0,71.074,_ZN5aiter42f4gemm_bf16_per1x32Fp4_BpreShuffle_192x256E
256,64,4608,16384,22,0,71.0803,_ZN5aiter42f4gemm_bf16_per1x32Fp4_BpreShuffle_192x256E
256,64,9216,16384,22,0,72.79,_ZN5aiter42f4gemm_bf16_per1x32Fp4_BpreShuffle_192x256E
256,64,13312,16384,22,0,73.7269,_ZN5aiter42f4gemm_bf16_per1x32Fp4_BpreShuffle_192x256E
256,64,16384,2048,22,0,15.9967,_ZN5aiter42f4gemm_bf16_per1x32Fp4_BpreShuffle_192x256E
256,64,16384,4096,22,0,24.9174,_ZN5aiter42f4gemm_bf16_per1x32Fp4_BpreShuffle_192x256E
256,64,16384,6656,22,0,29.7224,_ZN5aiter42f4gemm_bf16_per1x32Fp4_BpreShuffle_192x256E
256,64,16384,8192,22,0,42.3136,_ZN5aiter42f4gemm_bf16_per1x32Fp4_BpreShuffle_192x256E
256,64,16384,13312,22,0,63.2353,_ZN5aiter42f4gemm_bf16_per1x32Fp4_BpreShuffle_192x256E
256,64,16384,26624,22,0,118.0797,_ZN5aiter42f4gemm_bf16_per1x32Fp4_BpreShuffle_192x256E
256,64,26624,16384,22,0,81.4048,_ZN5aiter42f4gemm_bf16_per1x32Fp4_BpreShuffle_192x256E
256,64,53248,16384,22,0,101.678,_ZN5aiter42f4gemm_bf16_per1x32Fp4_BpreShuffle_192x256E
256,128,2304,16384,22,0,92.3753,_ZN5aiter42f4gemm_bf16_per1x32Fp4_BpreShuffle_192x256E
256,128,4608,16384,22,0,91.2541,_ZN5aiter42f4gemm_bf16_per1x32Fp4_BpreShuffle_192x256E
256,128,9216,16384,22,0,92.7914,_ZN5aiter42f4gemm_bf16_per1x32Fp4_BpreShuffle_192x256E
256,128,13312,16384,22,0,93.9115,_ZN5aiter42f4gemm_bf16_per1x32Fp4_BpreShuffle_192x256E
256,128,16384,2048,24,0,18.408,_ZN5aiter42f4gemm_bf16_per1x32Fp4_BpreShuffle_256x256E
256,128,16384,4096,22,0,29.868,_ZN5aiter42f4gemm_bf16_per1x32Fp4_BpreShuffle_192x256E
256,128,16384,6656,22,0,34.6837,_ZN5aiter42f4gemm_bf16_per1x32Fp4_BpreShuffle_192x256E
256,128,16384,8192,22,0,50.9228,_ZN5aiter42f4gemm_bf16_per1x32Fp4_BpreShuffle_192x256E
256,128,16384,13312,22,0,79.4221,_ZN5aiter42f4gemm_bf16_per1x32Fp4_BpreShuffle_192x256E
256,128,16384,26624,22,0,150.0883,_ZN5aiter42f4gemm_bf16_per1x32Fp4_BpreShuffle_192x256E
256,128,26624,16384,22,0,107.138,_ZN5aiter42f4gemm_bf16_per1x32Fp4_BpreShuffle_192x256E
256,128,53248,16384,22,0,141.2763,_ZN5aiter42f4gemm_bf16_per1x32Fp4_BpreShuffle_192x256E
256,256,2304,16384,21,0,108.4593,_ZN5aiter42f4gemm_bf16_per1x32Fp4_BpreShuffle_128x512E
256,256,4608,16384,22,0,107.8069,_ZN5aiter42f4gemm_bf16_per1x32Fp4_BpreShuffle_192x256E
256,256,9216,16384,22,0,108.3814,_ZN5aiter42f4gemm_bf16_per1x32Fp4_BpreShuffle_192x256E
256,256,13312,16384,22,0,110.1625,_ZN5aiter42f4gemm_bf16_per1x32Fp4_BpreShuffle_192x256E
256,256,16384,2048,22,0,21.1463,_ZN5aiter42f4gemm_bf16_per1x32Fp4_BpreShuffle_192x256E
256,256,16384,4096,22,0,34.0919,_ZN5aiter42f4gemm_bf16_per1x32Fp4_BpreShuffle_192x256E
256,256,16384,6656,22,0,38.0461,_ZN5aiter42f4gemm_bf16_per1x32Fp4_BpreShuffle_192x256E
256,256,16384,8192,22,0,59.9,_ZN5aiter42f4gemm_bf16_per1x32Fp4_BpreShuffle_192x256E
256,256,16384,13312,22,0,93.0116,_ZN5aiter42f4gemm_bf16_per1x32Fp4_BpreShuffle_192x256E
256,256,16384,26624,22,0,176.6064,_ZN5aiter42f4gemm_bf16_per1x32Fp4_BpreShuffle_192x256E
256,256,26624,16384,22,0,120.1856,_ZN5aiter42f4gemm_bf16_per1x32Fp4_BpreShuffle_192x256E
256,256,53248,16384,21,0,151.2215,_ZN5aiter42f4gemm_bf16_per1x32Fp4_BpreShuffle_128x512E
256,512,2304,16384,21,0,107.5004,_ZN5aiter42f4gemm_bf16_per1x32Fp4_BpreShuffle_128x512E
256,512,4608,16384,22,0,109.4743,_ZN5aiter42f4gemm_bf16_per1x32Fp4_BpreShuffle_192x256E
256,512,9216,16384,22,0,110.9333,_ZN5aiter42f4gemm_bf16_per1x32Fp4_BpreShuffle_192x256E
256,512,13312,16384,22,0,114.1209,_ZN5aiter42f4gemm_bf16_per1x32Fp4_BpreShuffle_192x256E
256,512,16384,2048,22,0,23.2178,_ZN5aiter42f4gemm_bf16_per1x32Fp4_BpreShuffle_192x256E
256,512,16384,4096,21,0,36.11,_ZN5aiter42f4gemm_bf16_per1x32Fp4_BpreShuffle_128x512E
256,512,16384,6656,22,0,42.752,_ZN5aiter42f4gemm_bf16_per1x32Fp4_BpreShuffle_192x256E
256,512,16384,8192,21,0,61.8761,_ZN5aiter42f4gemm_bf16_per1x32Fp4_BpreShuffle_128x512E
256,512,16384,13312,22,0,97.7111,_ZN5aiter42f4gemm_bf16_per1x32Fp4_BpreShuffle_192x256E
256,512,16384,26624,22,0,183.8225,_ZN5aiter42f4gemm_bf16_per1x32Fp4_BpreShuffle_192x256E
256,512,26624,16384,21,0,138.8661,_ZN5aiter42f4gemm_bf16_per1x32Fp4_BpreShuffle_128x512E
256,512,53248,16384,21,0,290.6719,_ZN5aiter42f4gemm_bf16_per1x32Fp4_BpreShuffle_128x512E
256,1024,2304,16384,21,0,107.5816,_ZN5aiter42f4gemm_bf16_per1x32Fp4_BpreShuffle_128x512E
256,1024,4608,16384,22,0,111.1722,_ZN5aiter42f4gemm_bf16_per1x32Fp4_BpreShuffle_192x256E
256,1024,9216,16384,22,0,114.4692,_ZN5aiter42f4gemm_bf16_per1x32Fp4_BpreShuffle_192x256E
256,1024,13312,16384,21,0,135.3356,_ZN5aiter42f4gemm_bf16_per1x32Fp4_BpreShuffle_128x512E
256,1024,16384,2048,21,0,25.9041,_ZN5aiter42f4gemm_bf16_per1x32Fp4_BpreShuffle_128x512E
256,1024,16384,4096,21,0,41.6209,_ZN5aiter42f4gemm_bf16_per1x32Fp4_BpreShuffle_128x512E
256,1024,16384,6656,24,0,54.1997,_ZN5aiter42f4gemm_bf16_per1x32Fp4_BpreShuffle_256x256E
256,1024,16384,8192,21,0,71.1258,_ZN5aiter42f4gemm_bf16_per1x32Fp4_BpreShuffle_128x512E
256,1024,16384,13312,21,0,107.964,_ZN5aiter42f4gemm_bf16_per1x32Fp4_BpreShuffle_128x512E
256,1024,16384,26624,21,0,209.6498,_ZN5aiter42f4gemm_bf16_per1x32Fp4_BpreShuffle_128x512E
256,1024,26624,16384,21,0,240.4895,_ZN5aiter42f4gemm_bf16_per1x32Fp4_BpreShuffle_128x512E
256,1024,53248,16384,21,0,568.4868,_ZN5aiter42f4gemm_bf16_per1x32Fp4_BpreShuffle_128x512E
256,2048,2304,16384,21,0,108.8889,_ZN5aiter42f4gemm_bf16_per1x32Fp4_BpreShuffle_128x512E
256,2048,4608,16384,22,0,115.5181,_ZN5aiter42f4gemm_bf16_per1x32Fp4_BpreShuffle_192x256E
256,2048,9216,16384,21,0,223.9904,_ZN5aiter42f4gemm_bf16_per1x32Fp4_BpreShuffle_128x512E
256,2048,13312,16384,21,0,238.795,_ZN5aiter42f4gemm_bf16_per1x32Fp4_BpreShuffle_128x512E
256,2048,16384,2048,21,0,48.2561,_ZN5aiter42f4gemm_bf16_per1x32Fp4_BpreShuffle_128x512E
256,2048,16384,4096,21,0,74.5022,_ZN5aiter42f4gemm_bf16_per1x32Fp4_BpreShuffle_128x512E
256,2048,16384,6656,21,0,102.0232,_ZN5aiter42f4gemm_bf16_per1x32Fp4_BpreShuffle_128x512E
256,2048,16384,8192,21,0,132.5113,_ZN5aiter42f4gemm_bf16_per1x32Fp4_BpreShuffle_128x512E
256,2048,16384,13312,21,0,201.9408,_ZN5aiter42f4gemm_bf16_per1x32Fp4_BpreShuffle_128x512E
256,2048,16384,26624,21,0,402.1677,_ZN5aiter42f4gemm_bf16_per1x32Fp4_BpreShuffle_128x512E
256,2048,26624,16384,21,0,455.1222,_ZN5aiter42f4gemm_bf16_per1x32Fp4_BpreShuffle_128x512E
256,2048,53248,16384,23,0,1020.5831,_ZN5aiter42f4gemm_bf16_per1x32Fp4_BpreShuffle_224x256E
256,4096,2304,16384,21,0,111.9014,_ZN5aiter42f4gemm_bf16_per1x32Fp4_BpreShuffle_128x512E
256,4096,4608,16384,21,0,229.3561,_ZN5aiter42f4gemm_bf16_per1x32Fp4_BpreShuffle_128x512E
256,4096,9216,16384,21,0,332.5793,_ZN5aiter42f4gemm_bf16_per1x32Fp4_BpreShuffle_128x512E
256,4096,13312,16384,21,0,452.543,_ZN5aiter42f4gemm_bf16_per1x32Fp4_BpreShuffle_128x512E
256,4096,16384,2048,21,0,89.4208,_ZN5aiter42f4gemm_bf16_per1x32Fp4_BpreShuffle_128x512E
256,4096,16384,4096,21,0,143.3347,_ZN5aiter42f4gemm_bf16_per1x32Fp4_BpreShuffle_128x512E
256,4096,16384,6656,21,0,187.1434,_ZN5aiter42f4gemm_bf16_per1x32Fp4_BpreShuffle_128x512E
256,4096,16384,8192,21,0,241.4522,_ZN5aiter42f4gemm_bf16_per1x32Fp4_BpreShuffle_128x512E
256,4096,16384,13312,21,0,375.9024,_ZN5aiter42f4gemm_bf16_per1x32Fp4_BpreShuffle_128x512E
256,4096,16384,26624,21,0,774.919,_ZN5aiter42f4gemm_bf16_per1x32Fp4_BpreShuffle_128x512E
256,4096,26624,16384,21,0,815.3837,_ZN5aiter42f4gemm_bf16_per1x32Fp4_BpreShuffle_128x512E
256,4096,53248,16384,23,0,1873.5902,_ZN5aiter42f4gemm_bf16_per1x32Fp4_BpreShuffle_224x256E
256,8192,2304,16384,21,0,206.6824,_ZN5aiter42f4gemm_bf16_per1x32Fp4_BpreShuffle_128x512E
256,8192,4608,16384,21,0,343.9039,_ZN5aiter42f4gemm_bf16_per1x32Fp4_BpreShuffle_128x512E
256,8192,9216,16384,21,0,575.8693,_ZN5aiter42f4gemm_bf16_per1x32Fp4_BpreShuffle_128x512E
256,8192,13312,16384,21,0,817.9465,_ZN5aiter42f4gemm_bf16_per1x32Fp4_BpreShuffle_128x512E
256,8192,16384,2048,21,0,173.5314,_ZN5aiter42f4gemm_bf16_per1x32Fp4_BpreShuffle_128x512E
256,8192,16384,4096,21,0,273.4299,_ZN5aiter42f4gemm_bf16_per1x32Fp4_BpreShuffle_128x512E
256,8192,16384,6656,21,0,367.9599,_ZN5aiter42f4gemm_bf16_per1x32Fp4_BpreShuffle_128x512E
256,8192,16384,8192,21,0,479.4436,_ZN5aiter42f4gemm_bf16_per1x32Fp4_BpreShuffle_128x512E
256,8192,16384,13312,21,0,736.0417,_ZN5aiter42f4gemm_bf16_per1x32Fp4_BpreShuffle_128x512E
256,8192,16384,26624,21,0,1541.7372,_ZN5aiter42f4gemm_bf16_per1x32Fp4_BpreShuffle_128x512E
256,8192,26624,16384,21,0,1511.9247,_ZN5aiter42f4gemm_bf16_per1x32Fp4_BpreShuffle_128x512E
256,8192,53248,16384,24,0,3487.837,_ZN5aiter42f4gemm_bf16_per1x32Fp4_BpreShuffle_256x256E
256,16384,2304,16384,21,0,319.2593,_ZN5aiter42f4gemm_bf16_per1x32Fp4_BpreShuffle_128x512E
256,16384,4608,16384,21,0,582.7793,_ZN5aiter42f4gemm_bf16_per1x32Fp4_BpreShuffle_128x512E
256,16384,9216,16384,21,0,1058.9369,_ZN5aiter42f4gemm_bf16_per1x32Fp4_BpreShuffle_128x512E
256,16384,13312,16384,21,0,1515.2712,_ZN5aiter42f4gemm_bf16_per1x32Fp4_BpreShuffle_128x512E
256,16384,16384,2048,21,0,333.8239,_ZN5aiter42f4gemm_bf16_per1x32Fp4_BpreShuffle_128x512E
256,16384,16384,4096,21,0,539.3316,_ZN5aiter42f4gemm_bf16_per1x32Fp4_BpreShuffle_128x512E
256,16384,16384,6656,21,0,742.6742,_ZN5aiter42f4gemm_bf16_per1x32Fp4_BpreShuffle_128x512E
256,16384,16384,8192,21,0,946.9637,_ZN5aiter42f4gemm_bf16_per1x32Fp4_BpreShuffle_128x512E
256,16384,16384,13312,21,0,1457.1619,_ZN5aiter42f4gemm_bf16_per1x32Fp4_BpreShuffle_128x512E
256,16384,16384,26624,21,0,3056.6872,_ZN5aiter42f4gemm_bf16_per1x32Fp4_BpreShuffle_128x512E
256,16384,26624,16384,21,0,3022.95,_ZN5aiter42f4gemm_bf16_per1x32Fp4_BpreShuffle_128x512E
256,16384,53248,16384,23,0,6935.401,_ZN5aiter42f4gemm_bf16_per1x32Fp4_BpreShuffle_224x256E
256,32768,2304,16384,21,0,567.9662,_ZN5aiter42f4gemm_bf16_per1x32Fp4_BpreShuffle_128x512E
256,32768,4608,16384,21,0,1073.3623,_ZN5aiter42f4gemm_bf16_per1x32Fp4_BpreShuffle_128x512E
256,32768,9216,16384,21,0,2140.2392,_ZN5aiter42f4gemm_bf16_per1x32Fp4_BpreShuffle_128x512E
256,32768,13312,16384,21,0,3016.9627,_ZN5aiter42f4gemm_bf16_per1x32Fp4_BpreShuffle_128x512E
256,32768,16384,2048,21,0,665.6559,_ZN5aiter42f4gemm_bf16_per1x32Fp4_BpreShuffle_128x512E
256,32768,16384,4096,21,0,1079.5229,_ZN5aiter42f4gemm_bf16_per1x32Fp4_BpreShuffle_128x512E
256,32768,16384,6656,21,0,1440.8879,_ZN5aiter42f4gemm_bf16_per1x32Fp4_BpreShuffle_128x512E
256,32768,16384,8192,21,0,1881.3883,_ZN5aiter42f4gemm_bf16_per1x32Fp4_BpreShuffle_128x512E
256,32768,16384,13312,21,0,2881.7149,_ZN5aiter42f4gemm_bf16_per1x32Fp4_BpreShuffle_128x512E
256,32768,16384,26624,21,0,6065.6024,_ZN5aiter42f4gemm_bf16_per1x32Fp4_BpreShuffle_128x512E
256,32768,26624,16384,21,0,6036.7678,_ZN5aiter42f4gemm_bf16_per1x32Fp4_BpreShuffle_128x512E
256,32768,53248,16384,23,0,13786.4608,_ZN5aiter42f4gemm_bf16_per1x32Fp4_BpreShuffle_224x256E
256,1,800,5120,22,0,21.1826,_ZN5aiter42f4gemm_bf16_per1x32Fp4_BpreShuffle_192x256E
256,1,5120,1280,24,0,10.6228,_ZN5aiter42f4gemm_bf16_per1x32Fp4_BpreShuffle_256x256E
256,1,5120,5120,22,0,21.6916,_ZN5aiter42f4gemm_bf16_per1x32Fp4_BpreShuffle_192x256E
256,1,5120,6400,22,0,25.1926,_ZN5aiter42f4gemm_bf16_per1x32Fp4_BpreShuffle_192x256E
256,1,5120,25600,22,0,80.971,_ZN5aiter42f4gemm_bf16_per1x32Fp4_BpreShuffle_192x256E
256,1,6400,5120,22,0,21.6256,_ZN5aiter42f4gemm_bf16_per1x32Fp4_BpreShuffle_192x256E
256,1,12800,5120,22,0,22.2311,_ZN5aiter42f4gemm_bf16_per1x32Fp4_BpreShuffle_192x256E
256,1,51200,5120,22,0,31.4607,_ZN5aiter42f4gemm_bf16_per1x32Fp4_BpreShuffle_192x256E
256,16,800,5120,22,0,21.2953,_ZN5aiter42f4gemm_bf16_per1x32Fp4_BpreShuffle_192x256E
256,16,5120,1280,24,0,10.5633,_ZN5aiter42f4gemm_bf16_per1x32Fp4_BpreShuffle_256x256E
256,16,5120,5120,22,0,21.8339,_ZN5aiter42f4gemm_bf16_per1x32Fp4_BpreShuffle_192x256E
256,16,5120,6400,22,0,25.6474,_ZN5aiter42f4gemm_bf16_per1x32Fp4_BpreShuffle_192x256E
256,16,5120,25600,22,0,81.7599,_ZN5aiter42f4gemm_bf16_per1x32Fp4_BpreShuffle_192x256E
256,16,6400,5120,22,0,22.5349,_ZN5aiter42f4gemm_bf16_per1x32Fp4_BpreShuffle_192x256E
256,16,12800,5120,22,0,22.5012,_ZN5aiter42f4gemm_bf16_per1x32Fp4_BpreShuffle_192x256E
256,16,51200,5120,22,0,31.0446,_ZN5aiter42f4gemm_bf16_per1x32Fp4_BpreShuffle_192x256E
256,32,800,5120,22,0,21.989,_ZN5aiter42f4gemm_bf16_per1x32Fp4_BpreShuffle_192x256E
256,32,5120,1280,24,0,10.7961,_ZN5aiter42f4gemm_bf16_per1x32Fp4_BpreShuffle_256x256E
256,32,5120,5120,22,0,23.3446,_ZN5aiter42f4gemm_bf16_per1x32Fp4_BpreShuffle_192x256E
256,32,5120,6400,22,0,25.8126,_ZN5aiter42f4gemm_bf16_per1x32Fp4_BpreShuffle_192x256E
256,32,5120,25600,22,0,92.6403,_ZN5aiter42f4gemm_bf16_per1x32Fp4_BpreShuffle_192x256E
256,32,6400,5120,22,0,23.2386,_ZN5aiter42f4gemm_bf16_per1x32Fp4_BpreShuffle_192x256E
256,32,12800,5120,22,0,24.1217,_ZN5aiter42f4gemm_bf16_per1x32Fp4_BpreShuffle_192x256E
256,32,51200,5120,22,0,32.5996,_ZN5aiter42f4gemm_bf16_per1x32Fp4_BpreShuffle_192x256E
256,64,800,5120,22,0,25.8477,_ZN5aiter42f4gemm_bf16_per1x32Fp4_BpreShuffle_192x256E
256,64,5120,1280,22,0,11.1583,_ZN5aiter42f4gemm_bf16_per1x32Fp4_BpreShuffle_192x256E
256,64,5120,5120,22,0,27.532,_ZN5aiter42f4gemm_bf16_per1x32Fp4_BpreShuffle_192x256E
256,64,5120,6400,22,0,25.4915,_ZN5aiter42f4gemm_bf16_per1x32Fp4_BpreShuffle_192x256E
256,64,5120,25600,22,0,109.1856,_ZN5aiter42f4gemm_bf16_per1x32Fp4_BpreShuffle_192x256E
256,64,6400,5120,22,0,27.7736,_ZN5aiter42f4gemm_bf16_per1x32Fp4_BpreShuffle_192x256E
256,64,12800,5120,22,0,28.2001,_ZN5aiter42f4gemm_bf16_per1x32Fp4_BpreShuffle_192x256E
256,64,51200,5120,24,0,39.1796,_ZN5aiter42f4gemm_bf16_per1x32Fp4_BpreShuffle_256x256E
256,128,800,5120,24,0,32.7867,_ZN5aiter42f4gemm_bf16_per1x32Fp4_BpreShuffle_256x256E
256,128,5120,1280,22,0,11.722,_ZN5aiter42f4gemm_bf16_per1x32Fp4_BpreShuffle_192x256E
256,128,5120,5120,22,0,33.783,_ZN5aiter42f4gemm_bf16_per1x32Fp4_BpreShuffle_192x256E
256,128,5120,6400,22,0,26.7835,_ZN5aiter42f4gemm_bf16_per1x32Fp4_BpreShuffle_192x256E
256,128,5120,25600,22,0,140.1972,_ZN5aiter42f4gemm_bf16_per1x32Fp4_BpreShuffle_192x256E
256,128,6400,5120,22,0,33.6507,_ZN5aiter42f4gemm_bf16_per1x32Fp4_BpreShuffle_192x256E
256,128,12800,5120,22,0,33.9284,_ZN5aiter42f4gemm_bf16_per1x32Fp4_BpreShuffle_192x256E
256,128,51200,5120,21,0,52.5393,_ZN5aiter42f4gemm_bf16_per1x32Fp4_BpreShuffle_128x512E
256,256,800,5120,22,0,36.8477,_ZN5aiter42f4gemm_bf16_per1x32Fp4_BpreShuffle_192x256E
256,256,5120,1280,22,0,11.8102,_ZN5aiter42f4gemm_bf16_per1x32Fp4_BpreShuffle_192x256E
256,256,5120,5120,22,0,38.9154,_ZN5aiter42f4gemm_bf16_per1x32Fp4_BpreShuffle_192x256E
256,256,5120,6400,22,0,27.5295,_ZN5aiter42f4gemm_bf16_per1x32Fp4_BpreShuffle_192x256E
256,256,5120,25600,22,0,166.5121,_ZN5aiter42f4gemm_bf16_per1x32Fp4_BpreShuffle_192x256E
256,256,6400,5120,22,0,39.3243,_ZN5aiter42f4gemm_bf16_per1x32Fp4_BpreShuffle_192x256E
256,256,12800,5120,22,0,40.3949,_ZN5aiter42f4gemm_bf16_per1x32Fp4_BpreShuffle_192x256E
256,256,51200,5120,21,0,60.5051,_ZN5aiter42f4gemm_bf16_per1x32Fp4_BpreShuffle_128x512E
256,512,800,5120,21,0,38.7761,_ZN5aiter42f4gemm_bf16_per1x32Fp4_BpreShuffle_128x512E
256,512,5120,1280,22,0,12.1842,_ZN5aiter42f4gemm_bf16_per1x32Fp4_BpreShuffle_192x256E
256,512,5120,5120,22,0,39.796,_ZN5aiter42f4gemm_bf16_per1x32Fp4_BpreShuffle_192x256E
256,512,5120,6400,22,0,28.4174,_ZN5aiter42f4gemm_bf16_per1x32Fp4_BpreShuffle_192x256E
256,512,5120,25600,22,0,167.8761,_ZN5aiter42f4gemm_bf16_per1x32Fp4_BpreShuffle_192x256E
256,512,6400,5120,22,0,40.5552,_ZN5aiter42f4gemm_bf16_per1x32Fp4_BpreShuffle_192x256E
256,512,12800,5120,22,0,42.4981,_ZN5aiter42f4gemm_bf16_per1x32Fp4_BpreShuffle_192x256E
256,512,51200,5120,21,0,105.2133,_ZN5aiter42f4gemm_bf16_per1x32Fp4_BpreShuffle_128x512E
256,1024,800,5120,23,0,46.2669,_ZN5aiter42f4gemm_bf16_per1x32Fp4_BpreShuffle_224x256E
256,1024,5120,1280,22,0,13.4783,_ZN5aiter42f4gemm_bf16_per1x32Fp4_BpreShuffle_192x256E
256,1024,5120,5120,21,0,44.3527,_ZN5aiter42f4gemm_bf16_per1x32Fp4_BpreShuffle_128x512E
256,1024,5120,6400,23,0,33.5992,_ZN5aiter42f4gemm_bf16_per1x32Fp4_BpreShuffle_224x256E
256,1024,5120,25600,22,0,171.1837,_ZN5aiter42f4gemm_bf16_per1x32Fp4_BpreShuffle_192x256E
256,1024,6400,5120,22,0,43.1962,_ZN5aiter42f4gemm_bf16_per1x32Fp4_BpreShuffle_192x256E
256,1024,12800,5120,24,0,57.2077,_ZN5aiter42f4gemm_bf16_per1x32Fp4_BpreShuffle_256x256E
256,1024,51200,5120,24,0,187.2715,_ZN5aiter42f4gemm_bf16_per1x32Fp4_BpreShuffle_256x256E
256,2048,800,5120,21,0,0.0,_ZN5aiter42f4gemm_bf16_per1x32Fp4_BpreShuffle_128x512E
256,2048,5120,1280,22,0,15.4982,_ZN5aiter42f4gemm_bf16_per1x32Fp4_BpreShuffle_192x256E
256,2048,5120,5120,21,0,46.2885,_ZN5aiter42f4gemm_bf16_per1x32Fp4_BpreShuffle_128x512E
256,2048,5120,6400,24,0,41.7888,_ZN5aiter42f4gemm_bf16_per1x32Fp4_BpreShuffle_256x256E
256,2048,5120,25600,22,0,174.6649,_ZN5aiter42f4gemm_bf16_per1x32Fp4_BpreShuffle_192x256E
256,2048,6400,5120,21,0,46.4622,_ZN5aiter42f4gemm_bf16_per1x32Fp4_BpreShuffle_128x512E
256,2048,12800,5120,21,0,99.5665,_ZN5aiter42f4gemm_bf16_per1x32Fp4_BpreShuffle_128x512E
256,2048,51200,5120,24,0,329.4363,_ZN5aiter42f4gemm_bf16_per1x32Fp4_BpreShuffle_256x256E
256,4096,800,5120,21,0,39.6258,_ZN5aiter42f4gemm_bf16_per1x32Fp4_BpreShuffle_128x512E
256,4096,5120,1280,21,0,29.7493,_ZN5aiter42f4gemm_bf16_per1x32Fp4_BpreShuffle_128x512E
256,4096,5120,5120,21,0,82.8112,_ZN5aiter42f4gemm_bf16_per1x32Fp4_BpreShuffle_128x512E
256,4096,5120,6400,24,0,78.0839,_ZN5aiter42f4gemm_bf16_per1x32Fp4_BpreShuffle_256x256E
256,4096,5120,25600,21,0,335.5366,_ZN5aiter42f4gemm_bf16_per1x32Fp4_BpreShuffle_128x512E
256,4096,6400,5120,23,0,104.9868,_ZN5aiter42f4gemm_bf16_per1x32Fp4_BpreShuffle_224x256E
256,4096,12800,5120,24,0,173.0755,_ZN5aiter42f4gemm_bf16_per1x32Fp4_BpreShuffle_256x256E
256,4096,51200,5120,24,0,615.387,_ZN5aiter42f4gemm_bf16_per1x32Fp4_BpreShuffle_256x256E
256,8192,800,5120,21,0,41.7607,_ZN5aiter42f4gemm_bf16_per1x32Fp4_BpreShuffle_128x512E
256,8192,5120,1280,24,0,45.8718,_ZN5aiter42f4gemm_bf16_per1x32Fp4_BpreShuffle_256x256E
256,8192,5120,5120,23,0,150.9595,_ZN5aiter42f4gemm_bf16_per1x32Fp4_BpreShuffle_224x256E
256,8192,5120,6400,24,0,128.6764,_ZN5aiter42f4gemm_bf16_per1x32Fp4_BpreShuffle_256x256E
256,8192,5120,25600,21,0,515.1458,_ZN5aiter42f4gemm_bf16_per1x32Fp4_BpreShuffle_128x512E
256,8192,6400,5120,21,0,160.4623,_ZN5aiter42f4gemm_bf16_per1x32Fp4_BpreShuffle_128x512E
256,8192,12800,5120,24,0,315.7672,_ZN5aiter42f4gemm_bf16_per1x32Fp4_BpreShuffle_256x256E
256,8192,51200,5120,24,0,1047.6126,_ZN5aiter42f4gemm_bf16_per1x32Fp4_BpreShuffle_256x256E
256,16384,800,5120,21,0,48.5545,_ZN5aiter42f4gemm_bf16_per1x32Fp4_BpreShuffle_128x512E
256,16384,5120,1280,24,0,80.3199,_ZN5aiter42f4gemm_bf16_per1x32Fp4_BpreShuffle_256x256E
256,16384,5120,5120,21,0,213.8374,_ZN5aiter42f4gemm_bf16_per1x32Fp4_BpreShuffle_128x512E
256,16384,5120,6400,21,0,227.3158,_ZN5aiter42f4gemm_bf16_per1x32Fp4_BpreShuffle_128x512E
256,16384,5120,25600,21,0,883.88,_ZN5aiter42f4gemm_bf16_per1x32Fp4_BpreShuffle_128x512E
256,16384,6400,5120,21,0,294.6844,_ZN5aiter42f4gemm_bf16_per1x32Fp4_BpreShuffle_128x512E
256,16384,12800,5120,24,0,603.8703,_ZN5aiter42f4gemm_bf16_per1x32Fp4_BpreShuffle_256x256E
256,16384,51200,5120,24,0,2073.2909,_ZN5aiter42f4gemm_bf16_per1x32Fp4_BpreShuffle_256x256E
256,32768,5120,1280,21,0,155.9821,_ZN5aiter42f4gemm_bf16_per1x32Fp4_BpreShuffle_128x512E
256,32768,5120,5120,21,0,431.6139,_ZN5aiter42f4gemm_bf16_per1x32Fp4_BpreShuffle_128x512E
256,32768,5120,6400,24,0,456.7883,_ZN5aiter42f4gemm_bf16_per1x32Fp4_BpreShuffle_256x256E
256,32768,5120,25600,21,0,1746.4555,_ZN5aiter42f4gemm_bf16_per1x32Fp4_BpreShuffle_128x512E
256,32768,6400,5120,21,0,555.166,_ZN5aiter42f4gemm_bf16_per1x32Fp4_BpreShuffle_128x512E
256,32768,12800,5120,24,0,1278.2909,_ZN5aiter42f4gemm_bf16_per1x32Fp4_BpreShuffle_256x256E
256,32768,51200,5120,24,0,4120.485,_ZN5aiter42f4gemm_bf16_per1x32Fp4_BpreShuffle_256x256E
256,4,16384,4096,22,0,21.86,_ZN5aiter42f4gemm_bf16_per1x32Fp4_BpreShuffle_192x256E
256,8,18432,16384,22,0,59.6071,_ZN5aiter42f4gemm_bf16_per1x32Fp4_BpreShuffle_192x256E
256,8,26624,16384,24,0,82.4334,_ZN5aiter42f4gemm_bf16_per1x32Fp4_BpreShuffle_256x256E
256,16,16384,16384,23,0,64.5006,_ZN5aiter42f4gemm_bf16_per1x32Fp4_BpreShuffle_224x256E
256,16,16384,53248,22,0,172.551,_ZN5aiter42f4gemm_bf16_per1x32Fp4_BpreShuffle_192x256E
256,16,18432,16384,22,0,60.0972,_ZN5aiter42f4gemm_bf16_per1x32Fp4_BpreShuffle_192x256E
256,16,106496,16384,21,0,163.0693,_ZN5aiter42f4gemm_bf16_per1x32Fp4_BpreShuffle_128x512E
256,32,16384,53248,22,0,173.429,_ZN5aiter42f4gemm_bf16_per1x32Fp4_BpreShuffle_192x256E
256,32,18432,16384,22,0,63.2576,_ZN5aiter42f4gemm_bf16_per1x32Fp4_BpreShuffle_192x256E
256,64,16384,16384,22,0,61.7101,_ZN5aiter42f4gemm_bf16_per1x32Fp4_BpreShuffle_192x256E
256,64,16384,53248,22,0,178.4558,_ZN5aiter42f4gemm_bf16_per1x32Fp4_BpreShuffle_192x256E
256,64,18432,16384,22,0,63.2113,_ZN5aiter42f4gemm_bf16_per1x32Fp4_BpreShuffle_192x256E
256,128,18432,16384,22,0,67.9262,_ZN5aiter42f4gemm_bf16_per1x32Fp4_BpreShuffle_192x256E
256,128,106496,16384,21,0,170.5967,_ZN5aiter42f4gemm_bf16_per1x32Fp4_BpreShuffle_128x512E
256,256,106496,16384,22,0,422.1716,_ZN5aiter42f4gemm_bf16_per1x32Fp4_BpreShuffle_192x256E
256,1024,106496,16384,24,0,921.4139,_ZN5aiter42f4gemm_bf16_per1x32Fp4_BpreShuffle_256x256E
