aiter/configs/a8w8_tuned_batched_gemm.csv
cu_num,B,M,N,K,kernelId,splitK,us,kernelName
304,16,1,1280,8192,60,0,58.7901,a8w8_batched_rowwise_128x16x32x128_16x16_1x1_8x16x1_8x16x1_1x16x1x8_4x4x1_1x1_intrawave_v2
304,16,32,1280,8192,28,0,68.9821,a8w8_batched_rowwise_256x32x128x256_32x32_1x1_16x16x1_16x16x1_1x32x1x8_8x8x1_1x1_intrawave_v3
304,16,64,1280,8192,21,0,74.9374,a8w8_batched_rowwise_256x64x128x256_32x32_1x2_16x16x1_16x16x1_1x32x1x8_8x8x1_1x1_intrawave_v3
304,16,128,1280,8192,41,0,111.2581,a8w8_batched_rowwise_256x128x128x128_32x32_2x2_8x32x1_8x32x1_1x32x1x8_8x8x1_1x1_intrawave_v5
304,16,192,1280,8192,11,0,136.9273,a8w8_batched_rowwise_256x128x160x128_32x32_1x5_8x32x1_8x32x1_1x64x1x4_8x8x1_1x1_intrawave_v3
304,16,256,1280,8192,11,0,150.6582,a8w8_batched_rowwise_256x128x160x128_32x32_1x5_8x32x1_8x32x1_1x64x1x4_8x8x1_1x1_intrawave_v3
304,16,320,1280,8192,41,0,194.5238,a8w8_batched_rowwise_256x128x128x128_32x32_2x2_8x32x1_8x32x1_1x32x1x8_8x8x1_1x1_intrawave_v5
304,16,512,1280,8192,4,0,235.9793,a8w8_batched_rowwise_256x256x160x128_32x32_2x5_8x32x1_8x32x1_1x64x1x4_8x8x1_2x1_intrawave_v3
304,16,1024,1280,8192,4,0,457.3867,a8w8_batched_rowwise_256x256x160x128_32x32_2x5_8x32x1_8x32x1_1x64x1x4_8x8x1_2x1_intrawave_v3
304,16,2048,1280,8192,13,0,831.9798,a8w8_batched_rowwise_256x128x128x128_32x32_2x2_8x32x1_8x32x1_1x32x1x8_8x8x1_1x1_intrawave_v3
304,16,4096,1280,8192,39,0,1490.3195,a8w8_batched_rowwise_256x224x256x128_16x16_7x8_8x32x1_8x32x1_1x32x1x8_8x8x1_1x2_intrawave_v3
304,16,8192,1280,8192,1,0,2894.8037,a8w8_batched_rowwise_256x256x256x128_32x32_4x4_8x32x1_8x32x1_1x32x1x8_8x8x1_1x1_intrawave_v3
304,16,16384,1280,8192,1,0,5696.639,a8w8_batched_rowwise_256x256x256x128_32x32_4x4_8x32x1_8x32x1_1x32x1x8_8x8x1_1x1_intrawave_v3
304,16,1,8192,1024,78,0,37.703,a8w8_batched_rowwise_64x16x16x128_16x16_1x1_8x8x1_8x8x1_1x16x1x4_4x4x1_1x1_interwave_v2
304,16,32,8192,1024,62,0,46.8522,a8w8_batched_rowwise_128x32x64x128_32x32_1x1_8x16x1_8x16x1_1x16x1x8_8x8x1_1x1_intrawave_v2
304,16,64,8192,1024,47,0,56.4451,a8w8_batched_rowwise_256x64x64x128_32x32_1x1_8x32x1_8x32x1_1x32x1x8_8x8x1_1x1_intrawave_v3
304,16,128,8192,1024,13,0,78.8949,a8w8_batched_rowwise_256x128x128x128_32x32_2x2_8x32x1_8x32x1_1x32x1x8_8x8x1_1x1_intrawave_v3
304,16,192,8192,1024,39,0,113.2351,a8w8_batched_rowwise_256x224x256x128_16x16_7x8_8x32x1_8x32x1_1x32x1x8_8x8x1_1x2_intrawave_v3
304,16,256,8192,1024,13,0,127.391,a8w8_batched_rowwise_256x128x128x128_32x32_2x2_8x32x1_8x32x1_1x32x1x8_8x8x1_1x1_intrawave_v3
304,16,320,8192,1024,13,0,172.9103,a8w8_batched_rowwise_256x128x128x128_32x32_2x2_8x32x1_8x32x1_1x32x1x8_8x8x1_1x1_intrawave_v3
304,16,512,8192,1024,13,0,229.5169,a8w8_batched_rowwise_256x128x128x128_32x32_2x2_8x32x1_8x32x1_1x32x1x8_8x8x1_1x1_intrawave_v3
304,16,1024,8192,1024,13,0,426.5342,a8w8_batched_rowwise_256x128x128x128_32x32_2x2_8x32x1_8x32x1_1x32x1x8_8x8x1_1x1_intrawave_v3
304,16,2048,8192,1024,13,0,823.4174,a8w8_batched_rowwise_256x128x128x128_32x32_2x2_8x32x1_8x32x1_1x32x1x8_8x8x1_1x1_intrawave_v3
304,16,4096,8192,1024,1,0,1583.6971,a8w8_batched_rowwise_256x256x256x128_32x32_4x4_8x32x1_8x32x1_1x32x1x8_8x8x1_1x1_intrawave_v3
304,16,8192,8192,1024,13,0,3131.9626,a8w8_batched_rowwise_256x128x128x128_32x32_2x2_8x32x1_8x32x1_1x32x1x8_8x8x1_1x1_intrawave_v3
304,16,16384,8192,1024,1,0,6094.2926,a8w8_batched_rowwise_256x256x256x128_32x32_4x4_8x32x1_8x32x1_1x32x1x8_8x8x1_1x1_intrawave_v3
