aiter/configs/bf16_tuned_batched_gemm.csv
cu_num,B,M,N,K,kernelId,splitK,us,kernelName
304,16,1,1280,8192,78,0,111.9323,bf16_batched_64x16x16x64_16x16_1x1_8x8x1_8x8x1_1x16x1x4_4x4x1_1x1_interwave_v2
304,16,32,1280,8192,29,0,123.5316,bf16_batched_256x32x96x128_16x16_1x3_16x16x1_16x16x1_1x32x1x8_4x4x1_1x1_intrawave_v3
304,16,64,1280,8192,21,0,133.0927,bf16_batched_256x64x128x128_32x32_1x2_16x16x1_16x16x1_1x32x1x8_8x8x1_1x1_intrawave_v3
304,16,128,1280,8192,41,0,197.9104,bf16_batched_256x128x128x64_32x32_2x2_8x32x1_8x32x1_1x32x1x8_8x8x1_1x1_intrawave_v5
304,16,192,1280,8192,11,0,231.4153,bf16_batched_256x128x160x64_32x32_1x5_8x32x1_8x32x1_1x64x1x4_8x8x1_1x1_intrawave_v3
304,16,256,1280,8192,11,0,256.7255,bf16_batched_256x128x160x64_32x32_1x5_8x32x1_8x32x1_1x64x1x4_8x8x1_1x1_intrawave_v3
304,16,320,1280,8192,13,0,329.4822,bf16_batched_256x128x128x64_32x32_2x2_8x32x1_8x32x1_1x32x1x8_8x8x1_1x1_intrawave_v3
304,16,512,1280,8192,11,0,461.2279,bf16_batched_256x128x160x64_32x32_1x5_8x32x1_8x32x1_1x64x1x4_8x8x1_1x1_intrawave_v3
304,16,1024,1280,8192,41,0,773.6965,bf16_batched_256x128x128x64_32x32_2x2_8x32x1_8x32x1_1x32x1x8_8x8x1_1x1_intrawave_v5
304,16,2048,1280,8192,41,0,1381.6015,bf16_batched_256x128x128x64_32x32_2x2_8x32x1_8x32x1_1x32x1x8_8x8x1_1x1_intrawave_v5
304,16,4096,1280,8192,41,0,2666.4169,bf16_batched_256x128x128x64_32x32_2x2_8x32x1_8x32x1_1x32x1x8_8x8x1_1x1_intrawave_v5
304,16,8192,1280,8192,41,0,5488.8801,bf16_batched_256x128x128x64_32x32_2x2_8x32x1_8x32x1_1x32x1x8_8x8x1_1x1_intrawave_v5
304,16,16384,1280,8192,41,0,11248.3376,bf16_batched_256x128x128x64_32x32_2x2_8x32x1_8x32x1_1x32x1x8_8x8x1_1x1_intrawave_v5
304,16,1,8192,1024,79,0,75.979,bf16_batched_128x16x32x64_16x16_1x1_8x16x1_8x16x1_1x16x1x8_4x4x1_1x1_interwave_v2
304,16,32,8192,1024,30,0,84.2878,bf16_batched_256x32x64x256_16x16_1x2_32x8x1_32x8x1_1x32x1x8_8x8x1_1x2_intrawave_v3
304,16,64,8192,1024,46,0,98.1849,bf16_batched_256x64x128x64_32x32_1x2_8x32x1_8x32x1_1x32x1x8_8x8x1_1x1_intrawave_v3
304,16,128,8192,1024,13,0,125.0599,bf16_batched_256x128x128x64_32x32_2x2_8x32x1_8x32x1_1x32x1x8_8x8x1_1x1_intrawave_v3
304,16,192,8192,1024,13,0,169.3914,bf16_batched_256x128x128x64_32x32_2x2_8x32x1_8x32x1_1x32x1x8_8x8x1_1x1_intrawave_v3
304,16,256,8192,1024,13,0,182.1985,bf16_batched_256x128x128x64_32x32_2x2_8x32x1_8x32x1_1x32x1x8_8x8x1_1x1_intrawave_v3
304,16,320,8192,1024,13,0,245.1626,bf16_batched_256x128x128x64_32x32_2x2_8x32x1_8x32x1_1x32x1x8_8x8x1_1x1_intrawave_v3
304,16,512,8192,1024,13,0,322.0123,bf16_batched_256x128x128x64_32x32_2x2_8x32x1_8x32x1_1x32x1x8_8x8x1_1x1_intrawave_v3
304,16,1024,8192,1024,13,0,594.1558,bf16_batched_256x128x128x64_32x32_2x2_8x32x1_8x32x1_1x32x1x8_8x8x1_1x1_intrawave_v3
304,16,2048,8192,1024,0,0,1133.4458,bf16_batched_256x256x256x32_32x32_4x4_4x64x1_4x64x1_1x32x1x8_8x8x1_1x1_intrawave_v4
304,16,4096,8192,1024,0,0,2168.7724,bf16_batched_256x256x256x32_32x32_4x4_4x64x1_4x64x1_1x32x1x8_8x8x1_1x1_intrawave_v4
304,16,8192,8192,1024,13,0,4318.3042,bf16_batched_256x128x128x64_32x32_2x2_8x32x1_8x32x1_1x32x1x8_8x8x1_1x1_intrawave_v3
304,16,16384,8192,1024,0,0,8164.1629,bf16_batched_256x256x256x32_32x32_4x4_4x64x1_4x64x1_1x32x1x8_8x8x1_1x1_intrawave_v4
