aiter/configs/tuned_fmoe.csv
token,model_dim,inter_dim,expert,topk,act_type,dtype,q_dtype_a,q_dtype_w,q_type,use_g1u1,doweight_stage1,block_m,ksplit,us1,kernelName1,err1,us2,kernelName2,err2,total_us
512,6144,4096,8,2,ActivationType.Silu,torch.bfloat16,torch.bfloat16,torch.bfloat16,QuantType.No,1,0,64,0,777.4775800000002,moe_ck2stages_gemm1_256x64x128x64_1x4_TypeCast_v1_Nswizzle0_no_MulRoutedWeight0_silu,0.0%,452.9029400000002,moe_ck2stages_gemm2_256x64x128x128_1x4_TypeCastExpertWeight_v1_Nswizzle0_no_MulRoutedWeight1,5.1%,1230.3805200000004
512,6144,4096,8,2,ActivationType.Silu,torch.bfloat16,torch.float8_e4m3fnuz,torch.float8_e4m3fnuz,QuantType.per_Token,1,0,64,0,333.61911999999967,_ZN5aiter44fmoe_stage1_bf16_pertokenFp8_g1u1_64x256_pf3E,0.0%,242.00890000000015,moe_ck2stages_gemm2_256x64x128x256_1x4_MulABScaleExpertWeight_v1_Nswizzle0_per_token_MulRoutedWeight1,5.1%,575.6280199999999
512,6144,4096,8,2,ActivationType.Silu,torch.bfloat16,torch.int8,torch.int8,QuantType.per_Tensor,1,0,64,0,345.3935200000011,_ZN5aiter45fmoe_stage1_bf16_pertokenInt8_g1u1_64x256_pf3E,0.0%,232.5357000000001,moe_ck2stages_gemm2_256x64x128x256_1x4_MulABScaleExpertWeight_v1_Nswizzle0_per_tensor_MulRoutedWeight1,5.0%,577.9292200000012
4,2304,1536,8,2,ActivationType.Gelu,torch.bfloat16,torch.float8_e4m3fnuz,torch.float8_e4m3fnuz,QuantType.per_Token,1,0,32,0,18.794269999999887,_ZN5aiter47fmoe_stage1_bf16_pertokenFp8_g1u1_32x64_4tg_pf3E,0.0%,17.210069999999984,moe_ck2stages_gemm2_256x32x128x256_1x4_MulABScaleExpertWeight_v1_Nswizzle0_per_token_MulRoutedWeight1,4.4%,36.00433999999987
4,2304,1536,8,2,ActivationType.Gelu,torch.bfloat16,torch.float8_e4m3fnuz,torch.float8_e4m3fnuz,QuantType.per_Token,1,1,32,0,19.469059999999992,_ZN5aiter57fmoe_stage1_bf16_pertokenFp8_doweight_g1u1_32x128_3tg_pf3E,0.0%,16.625269999999993,moe_ck2stages_gemm2_256x32x128x256_1x4_MulABScaleExpertWeight_v1_Nswizzle0_per_token_MulRoutedWeight0,3.2%,36.094329999999985
