aiter/configs/tuned_fmoe.csv
cu_num,token,model_dim,inter_dim,expert,topk,act_type,dtype,q_dtype_a,q_dtype_w,q_type,use_g1u1,doweight_stage1,block_m,ksplit,us1,kernelName1,err1,us2,kernelName2,err2,total_us,run_1stage
80,512,6144,4096,8,2,ActivationType.Silu,torch.bfloat16,torch.float8_e4m3fnuz,torch.float8_e4m3fnuz,QuantType.per_Token,1,0,64,0,376.5136,_ZN5aiter48fmoe_stage1_bf16_pertokenFp8_g1u1_64x128_2tg_pf3E,0.0%,271.6068,moe_ck2stages_gemm2_256x64x128x256_1x4_MulABScaleExpertWeight_v3_Nswizzle0_per_token_MulRoutedWeight1,2.4%,648.1204,0
80,512,6144,4096,8,2,ActivationType.Silu,torch.bfloat16,torch.int8,torch.int8,QuantType.per_Tensor,1,0,64,0,389.0831,_ZN5aiter49fmoe_stage1_bf16_pertokenInt8_g1u1_64x128_2tg_pf3E,0.0%,252.3165,moe_ck2stages_gemm2_256x64x128x128_1x4_MulABScaleExpertWeight_v3_Nswizzle0_per_tensor_MulRoutedWeight1,2.1%,641.3996,0
80,4,2304,1536,8,2,ActivationType.Gelu,torch.bfloat16,torch.float8_e4m3fnuz,torch.float8_e4m3fnuz,QuantType.per_Token,1,0,32,0,18.6055,moe_ck2stages_gemm1_256x32x64x256_1x4_MulABScale_v1_Nswizzle0_per_token_MulRoutedWeight0_silu,0.0%,14.5799,moe_ck2stages_gemm2_256x32x64x256_1x4_MulABScaleExpertWeight_v1_Nswizzle0_per_token_MulRoutedWeight1,0.3%,33.1854,0
80,4,2304,1536,8,2,ActivationType.Gelu,torch.bfloat16,torch.float8_e4m3fnuz,torch.float8_e4m3fnuz,QuantType.per_Token,1,1,32,0,19.76,moe_ck2stages_gemm1_256x32x64x128_1x4_MulABScale_v1_Nswizzle0_per_token_MulRoutedWeight1_silu,0.0%,14.9985,moe_ck2stages_gemm2_256x32x64x128_1x4_MulABScaleExpertWeight_v1_Nswizzle0_per_token_MulRoutedWeight0,0.0%,34.7585,0
80,512,6144,4096,8,2,ActivationType.Silu,torch.bfloat16,torch.bfloat16,torch.bfloat16,QuantType.No,1,0,64,0,809.8127,moe_ck2stages_gemm1_256x64x64x64_1x4_TypeCast_v1_Nswizzle0_no_MulRoutedWeight0_silu,0.0%,465.4021,moe_ck2stages_gemm2_256x64x128x64_1x4_TypeCastExpertWeight_v3_Nswizzle0_no_MulRoutedWeight1,2.3%,1275.2148,0
80,56,6144,4096,8,2,ActivationType.Silu,torch.bfloat16,torch.float8_e4m3fnuz,torch.float8_e4m3fnuz,QuantType.per_1x128,1,0,32,0,229.5518,_ZN5aiter47fmoe_bf16_blockscaleFp8_g1u1_vs_silu_1tg_32x256E,0.5%,0.0,None,0,229.5518,1
