aiter/ops/triton/configs/gemm/MI300X-FF-A16W16-fused.json
{
  "M_LEQ_4": {
    "BLOCK_SIZE_M": 4,
    "BLOCK_SIZE_N": 256,
    "BLOCK_SIZE_K": 64,
    "GROUP_SIZE_M": 1,
    "num_warps": 8,
    "num_stages": 2,
    "waves_per_eu": 3,
    "matrix_instr_nonkdim": 16,
    "cache_modifier": ".cg",
    "kpack": 1
  },
  "M_LEQ_8": {
    "BLOCK_SIZE_M": 8,
    "BLOCK_SIZE_N": 256,
    "BLOCK_SIZE_K": 64,
    "GROUP_SIZE_M": 1,
    "num_warps": 8,
    "num_stages": 2,
    "waves_per_eu": 2,
    "matrix_instr_nonkdim": 16,
    "cache_modifier": ".cg",
    "kpack": 1
  },
  "M_LEQ_64": {
    "BLOCK_SIZE_M": 64,
    "BLOCK_SIZE_N": 256,
    "BLOCK_SIZE_K": 128,
    "GROUP_SIZE_M": 1,
    "num_warps": 8,
    "num_stages": 1,
    "waves_per_eu": 2,
    "matrix_instr_nonkdim": 16,
    "cache_modifier": ".cg",
    "kpack": 1
  },
  "M_GEQ_4096": {
    "BLOCK_SIZE_M": 128,
    "BLOCK_SIZE_N": 256,
    "BLOCK_SIZE_K": 128,
    "GROUP_SIZE_M": 1,
    "num_warps": 8,
    "num_stages": 1,
    "waves_per_eu": 2,
    "matrix_instr_nonkdim": 16,
    "cache_modifier": null,
    "kpack": 1
  }
}
