aiter/ops/triton/configs/gemm/MI350X-GEMM-A16W16-ATOMIC-N=256-K=7168.json
{
  "small": {
    "BLOCK_SIZE_M": 16,
    "BLOCK_SIZE_N": 16,
    "BLOCK_SIZE_K": 256,
    "GROUP_SIZE_M": 1,
    "NUM_KSPLIT": 14,
    "cache_modifier": ".cg",
    "num_warps": 4,
    "num_stages": 2,
    "waves_per_eu": 4,
    "matrix_instr_nonkdim": 16,
    "kpack": 1
  },
  "medium_M32": {
    "BLOCK_SIZE_M": 16,
    "BLOCK_SIZE_N": 16,
    "BLOCK_SIZE_K": 256,
    "GROUP_SIZE_M": 1,
    "NUM_KSPLIT": 14,
    "cache_modifier": ".cg",
    "num_warps": 4,
    "num_stages": 2,
    "waves_per_eu": 4,
    "matrix_instr_nonkdim": 16,
    "kpack": 1
  },
  "medium_M64": {
    "BLOCK_SIZE_M": 16,
    "BLOCK_SIZE_N": 16,
    "BLOCK_SIZE_K": 256,
    "GROUP_SIZE_M": 1,
    "NUM_KSPLIT": 14,
    "cache_modifier": ".cg",
    "num_warps": 4,
    "num_stages": 2,
    "waves_per_eu": 4,
    "matrix_instr_nonkdim": 16,
    "kpack": 1
  },
  "medium_M128": {
    "BLOCK_SIZE_M": 16,
    "BLOCK_SIZE_N": 16,
    "BLOCK_SIZE_K": 128,
    "GROUP_SIZE_M": 1,
    "NUM_KSPLIT": 14,
    "cache_modifier": ".cg",
    "num_warps": 4,
    "num_stages": 2,
    "waves_per_eu": 4,
    "matrix_instr_nonkdim": 16,
    "kpack": 1
  },
  "large": {
    "BLOCK_SIZE_M": 16,
    "BLOCK_SIZE_N": 16,
    "BLOCK_SIZE_K": 128,
    "GROUP_SIZE_M": 1,
    "NUM_KSPLIT": 14,
    "cache_modifier": ".cg",
    "num_warps": 4,
    "num_stages": 2,
    "waves_per_eu": 4,
    "matrix_instr_nonkdim": 16,
    "kpack": 1
  }, 
   "xlarge": {
    "BLOCK_SIZE_M": 256,
    "BLOCK_SIZE_N": 256,
    "BLOCK_SIZE_K": 64,
    "GROUP_SIZE_M": 4,
    "NUM_KSPLIT":1,
    "cache_modifier": null,
    "num_warps": 8,
    "num_stages": 2,
    "waves_per_eu": 2,
    "matrix_instr_nonkdim": 32,
    "kpack": 1
  }
}