aiter/ops/triton/configs/moe/MI350X-MOE-DEFAULT.json
{
  "small_M": {
    "BLOCK_SIZE_M": 64,
    "BLOCK_SIZE_N": 64,
    "BLOCK_SIZE_K": 64,
    "GROUP_SIZE_M": 1,
    "num_warps": 4,
    "num_stages": 2,
    "waves_per_eu": 1,
    "matrix_instr_nonkdim": 16,
    "kpack": 1
  },
  "medium_M": {
    "BLOCK_SIZE_M": 128,
    "BLOCK_SIZE_N": 128,
    "BLOCK_SIZE_K": 128,
    "GROUP_SIZE_M": 1,
    "num_warps": 4,
    "num_stages": 1,
    "waves_per_eu": 2,
    "matrix_instr_nonkdim": 16,
    "kpack": 1
  },
  "large_M": {
    "BLOCK_SIZE_M": 256,
    "BLOCK_SIZE_N": 256,
    "BLOCK_SIZE_K": 64,
    "GROUP_SIZE_M": 8,
    "num_warps": 8,
    "num_stages": 2,
    "waves_per_eu": 0,
    "matrix_instr_nonkdim": 16,
    "kpack": 1
  }
}
